name,code,expiration_date,description
TUMS,KCP-393156341,2023/02/16,et magnis dis parturient montes nascetur ridiculus mus etiam vel augue vestibulum rutrum rutrum neque aenean
COMETRIQ,LKM-455728038,2024/12/21,et ultrices posuere cubilia curae donec pharetra magna vestibulum aliquet ultrices erat tortor sollicitudin mi sit amet lobortis sapien sapien
DOUBLE PERFECTION LUMIERE,ZWN-135087657,2025/12/27,consequat varius integer ac leo pellentesque ultrices mattis odio donec vitae nisi nam ultrices libero
Hand Kleen Premium,CIO-044328535,2021/10/14,eros suspendisse accumsan tortor quis turpis sed ante vivamus tortor duis
Methylphenidate Hydrochloride,XTA-597211315,2021/08/28,sit amet nunc viverra dapibus nulla suscipit ligula in lacus curabitur at ipsum
WATER HEMP POLLEN,QUC-563142100,2024/06/11,iaculis diam erat fermentum justo nec condimentum neque sapien placerat ante nulla justo
Olanzapine,YTC-624636246,2022/05/26,orci mauris lacinia sapien quis libero nullam sit amet turpis elementum ligula
Carvedilol,VGU-536655188,2023/04/14,nulla sed accumsan felis ut at dolor quis odio consequat varius integer ac leo pellentesque ultrices mattis odio donec
ESIKA,ZKS-920164913,2022/08/07,vivamus vestibulum sagittis sapien cum sociis natoque penatibus et magnis dis parturient montes nascetur ridiculus mus etiam vel
Ceftriaxone,RMV-662512426,2023/05/19,pellentesque ultrices mattis odio donec vitae nisi nam ultrices libero non mattis pulvinar nulla pede ullamcorper augue a
hydrocodone bitartrate and acetaminophen,HHZ-539592003,2023/09/07,pulvinar nulla pede ullamcorper augue a suscipit nulla elit ac nulla sed vel enim sit
Extra Strength Medicated Body,KRQ-701102089,2021/07/14,at velit eu est congue elementum in hac habitasse platea dictumst morbi vestibulum velit id pretium iaculis
Carbamazepine,AQD-200030906,2025/10/05,vel enim sit amet nunc viverra dapibus nulla suscipit ligula in lacus curabitur
DR. RECKEWEG R76 Herbamine Forte,OQE-562839419,2023/02/13,lectus pellentesque at nulla suspendisse potenti cras in purus eu magna vulputate luctus cum
Zolpidem Tartrate,TRV-960310996,2022/02/21,eget massa tempor convallis nulla neque libero convallis eget eleifend luctus ultricies eu
SYLVANT,QIZ-391500150,2026/05/29,diam erat fermentum justo nec condimentum neque sapien placerat ante nulla justo aliquam quis turpis
PAXIL,LJN-525674065,2022/03/09,eget tempus vel pede morbi porttitor lorem id ligula suspendisse ornare
Adapalene,ZOV-338250418,2021/10/29,rhoncus aliquam lacus morbi quis tortor id nulla ultrices aliquet maecenas leo odio condimentum id luctus nec molestie sed justo
Ibuprofen,WKT-265626323,2022/09/27,orci luctus et ultrices posuere cubilia curae donec pharetra magna vestibulum aliquet ultrices erat tortor sollicitudin mi
Propranolol Hydrochloride,SOB-411131128,2022/06/24,pede lobortis ligula sit amet eleifend pede libero quis orci
Quinapril Hydrochloride and Hydrochlorothiazide,JMT-551892214,2025/12/15,suscipit ligula in lacus curabitur at ipsum ac tellus semper interdum mauris ullamcorper purus sit amet nulla quisque arcu libero
clindamycin phosphate and benzoyl peroxide,BUO-338995314,2023/07/29,amet sem fusce consequat nulla nisl nunc nisl duis bibendum felis sed interdum venenatis turpis enim blandit mi in porttitor
Pleo Chrys,WCJ-789318805,2021/08/15,aliquam augue quam sollicitudin vitae consectetuer eget rutrum at lorem integer tincidunt ante vel ipsum
Longleaf Pine,VUL-596107982,2023/09/04,tempor turpis nec euismod scelerisque quam turpis adipiscing lorem vitae mattis nibh ligula nec sem duis aliquam
BZK Towelette,VGF-723629621,2021/09/10,vel augue vestibulum rutrum rutrum neque aenean auctor gravida sem praesent id massa id nisl
QUETIAPINE FUMARATE,UAR-389044653,2024/09/30,ac est lacinia nisi venenatis tristique fusce congue diam id ornare imperdiet sapien urna
Daily Moisturizing,DWJ-271158089,2026/05/25,et magnis dis parturient montes nascetur ridiculus mus vivamus vestibulum sagittis sapien cum sociis natoque
Diphenoxylate Hydrochloride and Atropine Sulfate,KXC-138806258,2021/09/03,venenatis lacinia aenean sit amet justo morbi ut odio cras mi pede malesuada
Coachs First Aid Contains 102 Pieces,HHD-070872014,2023/11/24,vivamus vel nulla eget eros elementum pellentesque quisque porta volutpat erat quisque erat
HydrALAZINE Hydrochloride,LJF-828753518,2025/12/28,lacus morbi quis tortor id nulla ultrices aliquet maecenas leo odio condimentum id luctus nec molestie sed justo
CARBAMAZEPINE,UDG-985086657,2024/04/21,duis bibendum morbi non quam nec dui luctus rutrum nulla tellus in sagittis dui vel nisl duis ac nibh
ACETAMINOPHEN,DXU-678773125,2021/10/29,vestibulum velit id pretium iaculis diam erat fermentum justo nec condimentum neque sapien placerat
Acebutolol Hydrochloride,EEE-044420280,2022/12/15,ut erat curabitur gravida nisi at nibh in hac habitasse platea dictumst aliquam augue quam sollicitudin vitae consectetuer eget rutrum
Equetro,ZIN-539295219,2021/05/17,augue vel accumsan tellus nisi eu orci mauris lacinia sapien quis libero nullam sit
Sterile Water,YBE-950754847,2023/11/19,venenatis non sodales sed tincidunt eu felis fusce posuere felis
BZK Towelette,HKP-260077733,2024/05/16,amet cursus id turpis integer aliquet massa id lobortis convallis tortor risus dapibus augue vel accumsan tellus nisi eu orci
Pleo Poly Om,DZT-766217043,2024/10/06,nisl ut volutpat sapien arcu sed augue aliquam erat volutpat in congue etiam
Procardia,RIT-071796687,2025/01/01,justo nec condimentum neque sapien placerat ante nulla justo aliquam quis turpis eget elit sodales scelerisque mauris sit
Clotrimazole,ZXL-084316989,2025/09/21,leo maecenas pulvinar lobortis est phasellus sit amet erat nulla tempus vivamus in felis eu sapien
SIMPLY RIGHT,LRT-628676491,2021/05/05,cursus vestibulum proin eu mi nulla ac enim in tempor turpis nec euismod scelerisque
Baclofen,MBT-062509954,2025/03/21,est lacinia nisi venenatis tristique fusce congue diam id ornare imperdiet sapien urna pretium
Spaced out,NZQ-080455672,2025/05/06,non ligula pellentesque ultrices phasellus id sapien in sapien iaculis congue vivamus metus arcu adipiscing molestie hendrerit
Famotidine,SWE-458980598,2026/01/31,mollis molestie lorem quisque ut erat curabitur gravida nisi at nibh in
Vaporizing Chest Rub,YKR-943459911,2023/09/19,nec molestie sed justo pellentesque viverra pede ac diam cras pellentesque volutpat
Western Juniper,NSV-777117195,2021/07/12,in ante vestibulum ante ipsum primis in faucibus orci luctus
Proactiv Solution,ZFW-802298029,2022/07/14,ut rhoncus aliquet pulvinar sed nisl nunc rhoncus dui vel sem sed sagittis nam congue risus semper porta volutpat quam
Oxytocin,PUM-800917178,2021/10/12,volutpat convallis morbi odio odio elementum eu interdum eu tincidunt in leo maecenas pulvinar lobortis est phasellus sit amet erat
SERTRALINE HYDROCHLORIDE,FXI-385647564,2023/09/17,faucibus orci luctus et ultrices posuere cubilia curae duis faucibus accumsan odio curabitur
Type 7 Stress Anxiety Max,SNB-250099913,2025/05/18,nulla tellus in sagittis dui vel nisl duis ac nibh fusce lacus purus
IBUPROFEN,GPD-071833092,2023/05/03,elementum eu interdum eu tincidunt in leo maecenas pulvinar lobortis est phasellus sit amet erat nulla
Amoxicillin and Clavulanate Potassium,TRV-043014907,2025/03/29,lectus suspendisse potenti in eleifend quam a odio in hac habitasse platea dictumst
Erythromycin,FEM-130470329,2025/03/30,ac enim in tempor turpis nec euismod scelerisque quam turpis adipiscing lorem
CAMBIA,OSZ-186412749,2021/05/27,convallis nulla neque libero convallis eget eleifend luctus ultricies eu nibh quisque id justo sit amet sapien dignissim vestibulum vestibulum
ULTRA THERAPY PAIN RELIEF,SID-613461134,2025/05/16,pharetra magna vestibulum aliquet ultrices erat tortor sollicitudin mi sit amet lobortis sapien sapien
Glipizide,BOU-925435249,2026/04/21,aliquet pulvinar sed nisl nunc rhoncus dui vel sem sed sagittis nam congue risus semper porta volutpat quam pede lobortis
leader cough dm,TBP-869541257,2024/12/12,lorem vitae mattis nibh ligula nec sem duis aliquam convallis nunc proin at
Acyclovir,IRN-758755847,2022/05/09,nulla facilisi cras non velit nec nisi vulputate nonummy maecenas tincidunt lacus at velit vivamus vel nulla eget eros elementum
EXTINA,LXO-281625232,2024/11/19,in est risus auctor sed tristique in tempus sit amet
Fresh Mint Dandruff,YNE-278156288,2022/04/06,vestibulum aliquet ultrices erat tortor sollicitudin mi sit amet lobortis
LISINOPRIL,RDO-155448831,2024/12/14,ante ipsum primis in faucibus orci luctus et ultrices posuere cubilia curae duis faucibus accumsan odio curabitur convallis
Lisinopril and Hydrochlorothiazide,BJD-227554160,2025/07/14,consectetuer adipiscing elit proin interdum mauris non ligula pellentesque ultrices phasellus id sapien in sapien
Famotidine,QNF-073224901,2021/12/01,amet eleifend pede libero quis orci nullam molestie nibh in lectus pellentesque at nulla suspendisse potenti cras
HYDROCODONE BITARTRATE AND ACETAMINOPHEN,SGI-522434204,2024/11/30,ut blandit non interdum in ante vestibulum ante ipsum primis in faucibus orci luctus et ultrices
Ropinirole Hydrochloride,MIY-599903180,2025/03/13,ullamcorper augue a suscipit nulla elit ac nulla sed vel enim sit amet nunc viverra dapibus
Ampicillin and Sulbactam,YPI-204826284,2022/05/02,non velit donec diam neque vestibulum eget vulputate ut ultrices vel augue vestibulum ante ipsum primis in faucibus orci luctus
Degree,GNW-693452865,2023/11/22,tempus sit amet sem fusce consequat nulla nisl nunc nisl duis bibendum felis sed interdum venenatis turpis enim blandit
Lamotrigine,KXN-608055035,2024/04/19,morbi vestibulum velit id pretium iaculis diam erat fermentum justo nec condimentum neque sapien placerat ante nulla justo aliquam
Speed Stick,OEJ-045905312,2025/07/09,ante nulla justo aliquam quis turpis eget elit sodales scelerisque mauris sit amet eros suspendisse accumsan tortor quis
TOPIRAMATE,OBT-538995094,2021/09/23,est et tempus semper est quam pharetra magna ac consequat metus sapien
Oxygen,NVG-070048106,2022/12/06,aliquet at feugiat non pretium quis lectus suspendisse potenti in eleifend
health mart ibuprofen,RHC-827811390,2023/05/24,dolor sit amet consectetuer adipiscing elit proin risus praesent lectus vestibulum quam sapien varius ut blandit non interdum in
ASPIRIN LOW DOSE,SQH-071934717,2025/12/16,venenatis tristique fusce congue diam id ornare imperdiet sapien urna pretium
Differin,YDH-623476438,2021/08/08,augue vestibulum ante ipsum primis in faucibus orci luctus et ultrices posuere
Naproxen,ZHI-446512636,2022/03/01,rutrum neque aenean auctor gravida sem praesent id massa id nisl venenatis lacinia aenean
SHISEIDO ADVANCED HYDRO-LIQUID COMPACT (REFILL),PSS-718947086,2025/09/15,pretium iaculis justo in hac habitasse platea dictumst etiam faucibus cursus urna ut tellus nulla ut erat id
simply right acetaminophen,CJB-136090673,2022/09/15,pretium nisl ut volutpat sapien arcu sed augue aliquam erat volutpat
SUGAR FREE SWISS CHERRY HERB THROAT DROPS,PRS-961074476,2025/11/19,congue eget semper rutrum nulla nunc purus phasellus in felis donec semper sapien
rx act ibuprofen,JWG-493851030,2021/04/14,nulla suscipit ligula in lacus curabitur at ipsum ac tellus semper interdum mauris ullamcorper purus
RABBIT,JQM-005621983,2025/07/08,nisl aenean lectus pellentesque eget nunc donec quis orci eget orci vehicula condimentum curabitur in
Perfect Choice,ADV-373367783,2022/09/15,iaculis diam erat fermentum justo nec condimentum neque sapien placerat ante nulla justo aliquam quis turpis eget elit sodales scelerisque
Milk of Magnesia Original,LCP-920224152,2023/09/20,augue aliquam erat volutpat in congue etiam justo etiam pretium iaculis justo in hac
Aurum Hypericum Stibium,KMF-792675004,2022/07/05,sem fusce consequat nulla nisl nunc nisl duis bibendum felis sed interdum venenatis turpis
Cisplatin,RLK-485023624,2026/04/08,non ligula pellentesque ultrices phasellus id sapien in sapien iaculis congue vivamus metus arcu adipiscing molestie hendrerit at vulputate vitae
ReHydration,YVX-030850192,2022/10/28,vel enim sit amet nunc viverra dapibus nulla suscipit ligula in
COTTON SEED,LEM-706737680,2022/07/25,dui maecenas tristique est et tempus semper est quam pharetra magna ac consequat metus sapien ut
ABSORBINE JR,NUL-225361877,2022/01/14,lacus curabitur at ipsum ac tellus semper interdum mauris ullamcorper purus sit amet nulla quisque arcu libero rutrum ac lobortis
Lisinopril,RMG-366494548,2024/08/02,imperdiet nullam orci pede venenatis non sodales sed tincidunt eu felis
Ibuprofen,HAO-494273861,2023/04/26,quis orci nullam molestie nibh in lectus pellentesque at nulla suspendisse potenti cras in purus eu magna
Clobetasol Propionate,FFH-526218014,2021/10/02,bibendum morbi non quam nec dui luctus rutrum nulla tellus in
Tobramycin and Dexamethasone,JCR-517521310,2021/07/23,mauris non ligula pellentesque ultrices phasellus id sapien in sapien iaculis congue vivamus metus arcu adipiscing molestie hendrerit at
Flu and Severe Cold and Cough,DCA-689562159,2023/10/15,mattis egestas metus aenean fermentum donec ut mauris eget massa tempor convallis nulla neque libero convallis eget
Oxymorphone Hydrochloride,INO-792126811,2025/11/11,velit vivamus vel nulla eget eros elementum pellentesque quisque porta volutpat erat quisque
Heparin Lock Flush,FJP-537906978,2023/09/28,donec ut dolor morbi vel lectus in quam fringilla rhoncus mauris enim leo rhoncus sed
Wart Remover Gel,FVS-699872528,2023/06/07,auctor gravida sem praesent id massa id nisl venenatis lacinia aenean sit amet justo morbi ut odio cras mi
PRIMAQUINE PHOSPHATE,WKH-575833841,2025/07/30,libero nam dui proin leo odio porttitor id consequat in consequat ut nulla sed accumsan felis
LETROZOLE,CUY-622599040,2024/03/15,at velit eu est congue elementum in hac habitasse platea dictumst morbi vestibulum
Vectibix,GCD-045417368,2021/08/15,adipiscing elit proin risus praesent lectus vestibulum quam sapien varius ut blandit non interdum in ante
Rugby,IZU-635154917,2024/09/02,vestibulum ante ipsum primis in faucibus orci luctus et ultrices
Korres Wild Rose Mineral Foundation,KNC-884374216,2024/06/03,tempus vivamus in felis eu sapien cursus vestibulum proin eu mi nulla ac enim in tempor
Ruby-Cell 4U Essential Silky Foaming Cleanser,ARD-662840942,2025/11/01,non velit nec nisi vulputate nonummy maecenas tincidunt lacus at
Childrens Fever Reliever,BCI-058024444,2021/11/12,odio porttitor id consequat in consequat ut nulla sed accumsan
Carbamazepine,ONB-664106533,2026/03/04,mauris vulputate elementum nullam varius nulla facilisi cras non velit nec nisi vulputate nonummy maecenas tincidunt
Dexamethasone sodium phosphate,UUE-076862763,2024/11/30,at velit vivamus vel nulla eget eros elementum pellentesque quisque porta volutpat erat quisque erat eros
hemorrhoidal cooling,RTQ-639672673,2021/06/23,nibh in quis justo maecenas rhoncus aliquam lacus morbi quis tortor id nulla ultrices aliquet maecenas leo odio
Pumpkin pie anti-bacterial SCENTED HAND SANITIZER,ZYK-670694439,2024/04/25,vestibulum sed magna at nunc commodo placerat praesent blandit nam nulla integer
Montelukast Sodium,JCI-146639660,2024/04/23,ante ipsum primis in faucibus orci luctus et ultrices posuere cubilia curae nulla dapibus dolor vel est donec odio
Carvedilol,NOI-527527731,2023/12/05,vitae quam suspendisse potenti nullam porttitor lacus at turpis donec posuere metus vitae ipsum aliquam non mauris morbi non
Altair Hand Care System Foam Anti-Bacterial Hand,CIC-239767115,2025/09/15,vestibulum vestibulum ante ipsum primis in faucibus orci luctus et ultrices posuere
Trichoderma harzianam,SJY-798018164,2023/06/16,lacinia erat vestibulum sed magna at nunc commodo placerat praesent blandit nam nulla integer pede justo
Honeysuckle Ginger Hand Sanitizer,XWJ-165651090,2025/04/07,sem praesent id massa id nisl venenatis lacinia aenean sit amet justo morbi ut odio cras mi pede
good sense ibuprofen,OYX-257488942,2022/06/22,iaculis congue vivamus metus arcu adipiscing molestie hendrerit at vulputate vitae nisl aenean lectus pellentesque eget nunc donec quis
Lisinopril,ZYH-375315306,2025/12/10,erat vestibulum sed magna at nunc commodo placerat praesent blandit nam nulla integer pede justo lacinia eget
Topamax,XZJ-865545583,2024/08/08,blandit nam nulla integer pede justo lacinia eget tincidunt eget tempus vel pede morbi porttitor lorem id ligula suspendisse
Urea,EJL-625890428,2022/02/04,sagittis sapien cum sociis natoque penatibus et magnis dis parturient montes nascetur
Doxycycline,UHE-597062492,2021/04/28,in quis justo maecenas rhoncus aliquam lacus morbi quis tortor id nulla ultrices aliquet maecenas leo odio condimentum id luctus
SPF 15,JBP-827331131,2024/02/02,vitae consectetuer eget rutrum at lorem integer tincidunt ante vel ipsum praesent blandit lacinia erat vestibulum
Vancomycin Hydrochloride,YFM-952962370,2024/11/10,vivamus tortor duis mattis egestas metus aenean fermentum donec ut mauris eget massa tempor convallis nulla neque libero convallis eget
Verapamil Hydrochloride,AKV-105877783,2023/10/04,cubilia curae mauris viverra diam vitae quam suspendisse potenti nullam porttitor
ULTRA CORRECTION LINE REPAIR,GOI-866577869,2025/11/25,augue vestibulum rutrum rutrum neque aenean auctor gravida sem praesent id massa
Topical Anesthetic,RIP-001950727,2023/03/27,arcu libero rutrum ac lobortis vel dapibus at diam nam
Guaifenesin,ZLL-297994039,2023/03/13,praesent blandit lacinia erat vestibulum sed magna at nunc commodo placerat praesent blandit nam nulla integer
OXYCODONE HYDROCHLORIDE,YGC-235891777,2021/10/19,dolor vel est donec odio justo sollicitudin ut suscipit a feugiat et eros vestibulum ac
4 in 1 Pressed Mineral SPF 15 Tan,XVT-985361022,2024/07/31,porttitor lacus at turpis donec posuere metus vitae ipsum aliquam
Promethazine Hydrochloride,DIB-339428249,2024/05/23,sollicitudin mi sit amet lobortis sapien sapien non mi integer ac neque
Donepezil hydrochloride,NMG-856800233,2025/04/14,est donec odio justo sollicitudin ut suscipit a feugiat et eros vestibulum ac est lacinia nisi venenatis
Balancing Day Moisture Broad Spectrum SPF 15,WCP-333772444,2024/12/27,vel sem sed sagittis nam congue risus semper porta volutpat quam pede
Laxative Pills,CYT-367468568,2023/08/19,eget rutrum at lorem integer tincidunt ante vel ipsum praesent blandit lacinia erat vestibulum sed magna at nunc commodo placerat
FREDS ADVANCED EYE DROPS,XLH-699616004,2021/09/22,sit amet nulla quisque arcu libero rutrum ac lobortis vel dapibus at
Skin Delight Mask Pack Plus,DSW-695056671,2024/05/24,sit amet cursus id turpis integer aliquet massa id lobortis convallis tortor risus dapibus
Cold Sore Treatment,OOP-468042293,2023/11/17,sem sed sagittis nam congue risus semper porta volutpat quam pede lobortis ligula sit amet
Lidocaine Hydrochloride,YJA-653434478,2021/12/01,risus semper porta volutpat quam pede lobortis ligula sit amet eleifend pede libero quis orci nullam molestie
Nifedipine,ZPO-675095030,2022/05/28,consectetuer eget rutrum at lorem integer tincidunt ante vel ipsum praesent blandit lacinia erat
careone sinus congestion and pain,HEL-536995182,2024/02/09,nulla tempus vivamus in felis eu sapien cursus vestibulum proin eu mi
Mamma (dextra) 6,JPO-348734066,2024/09/23,hac habitasse platea dictumst maecenas ut massa quis augue luctus tincidunt nulla mollis molestie lorem
Furosemide,MHR-318549975,2022/10/24,suspendisse accumsan tortor quis turpis sed ante vivamus tortor duis mattis egestas metus aenean
Progena,ITQ-301364930,2021/07/05,dui vel sem sed sagittis nam congue risus semper porta volutpat quam pede lobortis ligula sit
letrozole,ZGD-768343412,2022/12/28,curae donec pharetra magna vestibulum aliquet ultrices erat tortor sollicitudin mi sit amet lobortis sapien sapien non mi integer
DEXTROSE,DOB-465701422,2025/11/10,ut massa quis augue luctus tincidunt nulla mollis molestie lorem quisque ut
ALPRAZOLAM,TWP-321480782,2026/01/17,hendrerit at vulputate vitae nisl aenean lectus pellentesque eget nunc donec quis orci eget orci vehicula condimentum curabitur in libero
ONGLYZA,JTM-769246021,2022/09/03,pede venenatis non sodales sed tincidunt eu felis fusce posuere felis sed lacus
Donnatal,LKA-043462202,2026/01/26,vivamus tortor duis mattis egestas metus aenean fermentum donec ut mauris eget massa tempor convallis nulla neque
ALPRAZOLAM EXTENDED-RELEASE,POR-876436269,2025/05/11,sit amet lobortis sapien sapien non mi integer ac neque duis bibendum morbi non
Clear Proof Acne System The Go Set,CHM-228006496,2025/01/03,odio in hac habitasse platea dictumst maecenas ut massa quis augue luctus tincidunt
Food - Animal Products and Poultry Products, Pork Sus sp.,TAD-491120533,2023/01/23,sit amet erat nulla tempus vivamus in felis eu sapien cursus vestibulum proin eu mi nulla ac enim
LBEL EFFET PARFAIT MINERAL NATURAL SKIN EFFECT MOUSSE FOUNDATION SPF 16,WSE-382549415,2022/08/17,mauris morbi non lectus aliquam sit amet diam in magna bibendum imperdiet
Hydroxyzine Hydrochloride,DTO-763443694,2023/09/16,platea dictumst morbi vestibulum velit id pretium iaculis diam erat fermentum justo nec condimentum neque sapien
LISINOPRIL,MAY-449678778,2024/04/21,turpis sed ante vivamus tortor duis mattis egestas metus aenean fermentum donec ut mauris eget massa tempor convallis nulla neque
DONEPEZIL HYDROCHLORIDE,IKE-768329165,2022/05/25,nullam molestie nibh in lectus pellentesque at nulla suspendisse potenti
SHISEIDO RADIANT LIFTING FOUNDATION,DCL-333804484,2024/02/20,vestibulum quam sapien varius ut blandit non interdum in ante vestibulum ante ipsum primis in faucibus orci luctus et
AMOXICILLIN,ZUK-436880571,2021/08/03,pulvinar lobortis est phasellus sit amet erat nulla tempus vivamus in felis eu sapien
fluorodine ULTRA active Fluoride Anticavity,RGI-209888332,2023/11/23,proin eu mi nulla ac enim in tempor turpis nec euismod scelerisque quam turpis adipiscing
Hydrocortisone,PYX-020808402,2023/01/16,odio in hac habitasse platea dictumst maecenas ut massa quis augue luctus tincidunt nulla mollis molestie lorem quisque
Sulwhasoo Lumitouch Multi-Base,FJI-833175156,2023/11/07,tortor quis turpis sed ante vivamus tortor duis mattis egestas metus aenean
Zyprexa,XKK-638910320,2026/05/29,felis ut at dolor quis odio consequat varius integer ac leo pellentesque ultrices mattis odio donec vitae nisi nam ultrices
Bodycology,WUR-473018654,2024/03/13,varius ut blandit non interdum in ante vestibulum ante ipsum primis in faucibus orci luctus
Timeless EGF Power Emulsion,VAC-639124614,2023/03/10,accumsan felis ut at dolor quis odio consequat varius integer ac leo
KLENSKIN SHOWERON SUNSCREEN,VAG-827885023,2023/09/22,augue aliquam erat volutpat in congue etiam justo etiam pretium iaculis justo in hac habitasse platea dictumst
BENZPHETAMINE HYDROCHLORIDE,DFX-574028828,2023/11/15,maecenas tristique est et tempus semper est quam pharetra magna ac consequat metus
Simply Right Nicotine,MGL-166098179,2023/07/28,pede justo lacinia eget tincidunt eget tempus vel pede morbi porttitor lorem id ligula suspendisse ornare consequat lectus in est
Forest Fresh,MSD-939272895,2025/04/20,at nunc commodo placerat praesent blandit nam nulla integer pede justo lacinia eget tincidunt
Daytime Severe Cold and Flu,VOW-608953870,2021/05/05,turpis eget elit sodales scelerisque mauris sit amet eros suspendisse accumsan tortor quis turpis sed
MUSCLE THERAPY WITH ARNICA,EFY-003561941,2023/12/09,habitasse platea dictumst aliquam augue quam sollicitudin vitae consectetuer eget rutrum at lorem integer tincidunt ante vel ipsum praesent
Macadamia Nut,EOD-596439522,2023/10/22,elementum nullam varius nulla facilisi cras non velit nec nisi vulputate nonummy maecenas tincidunt lacus at velit vivamus
Sulwhasoo SNOWISE BRIGHTENING SERUM BB,FLQ-383550327,2022/01/26,venenatis turpis enim blandit mi in porttitor pede justo eu massa donec dapibus duis at
Nitrogen,ICC-455953234,2023/04/18,tellus in sagittis dui vel nisl duis ac nibh fusce lacus purus aliquet at feugiat
Jason Powersmile Anticavity ,Whitening Powerful Peppermint,XIO-396182408,2021/08/22,venenatis tristique fusce congue diam id ornare imperdiet sapien urna pretium nisl ut volutpat
Tag Away,SXH-141904889,2026/01/12,ut tellus nulla ut erat id mauris vulputate elementum nullam varius nulla facilisi cras non velit nec
Spironolactone,ZFQ-224371815,2024/12/05,vitae ipsum aliquam non mauris morbi non lectus aliquam sit amet diam in
SkinCeuticals Sheer Physical UV Defense Broad Spectrum SPF 30 Sunscreen,NJC-719993351,2024/07/05,quisque id justo sit amet sapien dignissim vestibulum vestibulum ante ipsum
Mirtazapine,SVK-178203693,2022/10/03,sed tristique in tempus sit amet sem fusce consequat nulla nisl nunc nisl duis bibendum
Ranitidine,NNF-729697405,2024/03/21,sed magna at nunc commodo placerat praesent blandit nam nulla integer pede justo lacinia
Readi-Cat2 Mochaccino Smoothie,QVI-091770654,2025/07/19,tincidunt eu felis fusce posuere felis sed lacus morbi sem mauris laoreet ut
Mint Fusion Lip Balm SPF 30,BIC-689493054,2023/05/23,id consequat in consequat ut nulla sed accumsan felis ut at dolor quis odio consequat varius integer ac leo
Hemorrhoidal,PQO-511933503,2025/01/25,libero non mattis pulvinar nulla pede ullamcorper augue a suscipit nulla elit ac nulla sed vel enim
Midazolam,AFF-353798146,2023/08/01,bibendum morbi non quam nec dui luctus rutrum nulla tellus
Triazolam,HRG-732878745,2023/12/24,platea dictumst aliquam augue quam sollicitudin vitae consectetuer eget rutrum at lorem integer tincidunt ante vel ipsum praesent blandit
Chidangwon 300,RIG-609469572,2021/09/03,vestibulum ante ipsum primis in faucibus orci luctus et ultrices posuere cubilia curae mauris viverra diam vitae quam suspendisse
OLEA EUROPAEA POLLEN,KTD-753382192,2024/09/28,in quis justo maecenas rhoncus aliquam lacus morbi quis tortor id nulla
Azithromycin Dihydrate,BAR-396728949,2022/02/08,elit ac nulla sed vel enim sit amet nunc viverra dapibus nulla suscipit ligula in lacus curabitur at ipsum
