name,code,expiration_date,description
Antihistimine Allergy,HLR-912395558,2024/04/10,aenean lectus pellentesque eget nunc donec quis orci eget orci vehicula condimentum curabitur in libero ut massa
Metoprolol succinate,NEU-288080193,2021/09/23,augue vestibulum rutrum rutrum neque aenean auctor gravida sem praesent id massa
SuperPlus Beblesh Balm SPF25 PA 2Plus,AZU-764728698,2023/02/05,vestibulum sagittis sapien cum sociis natoque penatibus et magnis dis parturient montes nascetur ridiculus mus etiam vel augue vestibulum rutrum
All Day Pain Relief,LBQ-983753434,2024/03/13,a ipsum integer a nibh in quis justo maecenas rhoncus aliquam lacus morbi quis tortor id nulla
Laxative pills,WXT-663173302,2026/03/19,blandit lacinia erat vestibulum sed magna at nunc commodo placerat
DG BODY,ICI-250505548,2021/05/13,erat fermentum justo nec condimentum neque sapien placerat ante nulla justo aliquam quis turpis eget elit sodales scelerisque mauris
Phenazopyridine Hydrochloride,UUO-435651704,2022/07/14,nunc commodo placerat praesent blandit nam nulla integer pede justo lacinia eget tincidunt eget tempus vel pede morbi porttitor lorem
SHISEIDO RADIANT LIFTING FOUNDATION,VTC-872204753,2025/12/29,amet erat nulla tempus vivamus in felis eu sapien cursus vestibulum proin eu mi
Pegasys,CQD-350634767,2021/07/06,nibh fusce lacus purus aliquet at feugiat non pretium quis lectus suspendisse
Mirtazapine,ZUM-975677560,2024/12/19,pharetra magna ac consequat metus sapien ut nunc vestibulum ante ipsum primis in
Fluconazole,QCU-774888379,2023/03/20,neque vestibulum eget vulputate ut ultrices vel augue vestibulum ante
Diphenhydramine HCl,JEH-899885365,2025/06/02,nibh fusce lacus purus aliquet at feugiat non pretium quis lectus suspendisse potenti
Pro-Den Rx,IKD-668741917,2026/04/16,massa volutpat convallis morbi odio odio elementum eu interdum eu tincidunt in leo maecenas pulvinar lobortis
Pacific Garden,HJU-786546679,2024/02/07,nulla sed accumsan felis ut at dolor quis odio consequat varius integer ac leo pellentesque ultrices mattis
Hydrocortisone,JSW-007983677,2022/05/04,tincidunt in leo maecenas pulvinar lobortis est phasellus sit amet erat nulla tempus vivamus in felis eu sapien
Kadian,XUC-718244430,2025/07/21,sem sed sagittis nam congue risus semper porta volutpat quam pede lobortis ligula sit amet
Sunmark cough dm,XVI-041238220,2025/10/25,turpis integer aliquet massa id lobortis convallis tortor risus dapibus augue vel accumsan
Wintergreen Isopropyl Alcohol,IMA-823441792,2021/10/02,non interdum in ante vestibulum ante ipsum primis in faucibus orci luctus et ultrices posuere cubilia curae duis faucibus
EROS AQUA SENSATIONS,ECG-492047952,2022/09/06,id lobortis convallis tortor risus dapibus augue vel accumsan tellus nisi eu orci mauris lacinia
SOLU-MEDROL,FPA-546402331,2026/02/12,magna vestibulum aliquet ultrices erat tortor sollicitudin mi sit amet lobortis sapien sapien non mi integer ac neque
Levetiracetam,CMS-776083807,2022/04/13,nisl venenatis lacinia aenean sit amet justo morbi ut odio cras mi pede malesuada in imperdiet et
Stay Awake,RXQ-464902911,2024/03/08,lacus morbi sem mauris laoreet ut rhoncus aliquet pulvinar sed nisl nunc rhoncus dui vel sem sed
Omeprazole,DAK-822261188,2022/07/31,massa tempor convallis nulla neque libero convallis eget eleifend luctus ultricies eu nibh quisque id justo sit
Tinidazole,XLC-703285407,2021/11/23,dictumst morbi vestibulum velit id pretium iaculis diam erat fermentum justo nec condimentum neque sapien placerat
Oxybutynin Chloride,GAY-624898406,2021/07/03,leo odio condimentum id luctus nec molestie sed justo pellentesque viverra pede ac diam cras pellentesque
Naproxen Delayed Release,FZW-574864946,2023/07/09,nibh fusce lacus purus aliquet at feugiat non pretium quis lectus suspendisse potenti in eleifend quam a odio in hac
OXYCODONE HYDROCHLORIDE,LBR-307879384,2024/09/24,duis at velit eu est congue elementum in hac habitasse platea dictumst morbi
Hydrocodone Bitartrate and Acetaminophen,BZI-642846397,2024/09/08,in est risus auctor sed tristique in tempus sit amet sem fusce consequat nulla nisl nunc nisl duis
ELOCON,EUR-321584190,2022/08/18,sapien iaculis congue vivamus metus arcu adipiscing molestie hendrerit at vulputate vitae
Mycophenolate Mofetil,KUF-558962680,2023/10/12,semper est quam pharetra magna ac consequat metus sapien ut nunc vestibulum ante ipsum primis in faucibus orci
Nicotine,DWH-667854261,2025/05/06,aenean sit amet justo morbi ut odio cras mi pede malesuada in imperdiet et commodo vulputate justo
Loratadine and Pseudoephedrine,RQZ-294172419,2026/03/01,vestibulum rutrum rutrum neque aenean auctor gravida sem praesent id massa id
Losartan Potassium,RCP-078003504,2024/11/06,integer non velit donec diam neque vestibulum eget vulputate ut ultrices vel augue vestibulum ante ipsum primis in faucibus
Paroxetine,NTD-775543880,2023/11/27,platea dictumst maecenas ut massa quis augue luctus tincidunt nulla mollis molestie lorem
Oxygen,LNK-045073755,2022/12/21,a odio in hac habitasse platea dictumst maecenas ut massa quis augue luctus
Furosemide,WUS-603726291,2022/02/08,quis odio consequat varius integer ac leo pellentesque ultrices mattis
Humalog,BPG-648061676,2022/03/27,ultrices posuere cubilia curae duis faucibus accumsan odio curabitur convallis duis consequat dui
Neutrogena Rapid Clear 2 in 1 Fight and Fade Toner,HFL-577146789,2023/04/03,euismod scelerisque quam turpis adipiscing lorem vitae mattis nibh ligula nec
Calcitriol,KOJ-874139229,2025/08/22,justo in hac habitasse platea dictumst etiam faucibus cursus urna ut tellus nulla
DR. RECKEWEG R53 Comedonin,RSB-669173520,2022/08/15,purus aliquet at feugiat non pretium quis lectus suspendisse potenti in eleifend quam a odio in hac habitasse
HYDROXYZINE PAMOATE,OIN-799252182,2024/02/09,justo lacinia eget tincidunt eget tempus vel pede morbi porttitor lorem id ligula suspendisse ornare consequat
Degree Clinical Protection Clean,ICK-148980021,2021/10/10,amet nulla quisque arcu libero rutrum ac lobortis vel dapibus
Zicam,NNE-548326592,2023/09/18,eleifend donec ut dolor morbi vel lectus in quam fringilla rhoncus mauris enim leo rhoncus sed vestibulum sit amet cursus
Antacid Antigas,BOF-140650046,2021/08/31,nunc commodo placerat praesent blandit nam nulla integer pede justo lacinia
HYPERT HP,BKV-301477515,2024/03/09,dui nec nisi volutpat eleifend donec ut dolor morbi vel lectus in quam
Lidocaine Hydrochloride and Epinephrine,EUK-284394915,2025/02/03,in porttitor pede justo eu massa donec dapibus duis at
Sonata,YRI-106512572,2023/02/10,enim sit amet nunc viverra dapibus nulla suscipit ligula in lacus curabitur at ipsum ac tellus semper
Cilostazol,SMH-026586056,2024/08/02,quis justo maecenas rhoncus aliquam lacus morbi quis tortor id nulla ultrices aliquet maecenas leo
Pollens - Trees, Birch Mix,BFT-701506650,2026/02/25,orci vehicula condimentum curabitur in libero ut massa volutpat convallis morbi odio
Alba TerraTint Blaze SPF 15 Lip Balm,PNX-786501896,2022/02/19,at nibh in hac habitasse platea dictumst aliquam augue quam sollicitudin
Aldactone,UMV-135406867,2024/04/16,nisi at nibh in hac habitasse platea dictumst aliquam augue quam sollicitudin vitae consectetuer eget rutrum at lorem
Lil Drug Store Ibuprofen,POY-738785790,2023/12/30,ipsum primis in faucibus orci luctus et ultrices posuere cubilia curae nulla dapibus dolor vel
ONDANSETRON HYDROCHLORIDE,JFZ-123496409,2024/06/24,sit amet lobortis sapien sapien non mi integer ac neque duis bibendum
Cephalexin,AKI-893736774,2021/04/06,tincidunt eget tempus vel pede morbi porttitor lorem id ligula suspendisse ornare consequat
Selsun Blue Normal to Oily,PHV-806876963,2024/07/06,vel nisl duis ac nibh fusce lacus purus aliquet at feugiat non
EARACHE KIDS RELIEF,EPJ-729662151,2025/03/25,pede venenatis non sodales sed tincidunt eu felis fusce posuere
healthy accents pain relief,SIC-633147977,2024/11/18,vel nisl duis ac nibh fusce lacus purus aliquet at feugiat non pretium quis lectus suspendisse potenti in
Morphine Sulfate,VYQ-882400645,2025/04/12,iaculis diam erat fermentum justo nec condimentum neque sapien placerat ante nulla justo aliquam quis turpis eget elit sodales scelerisque
Non-Drowsy Suphedrine PE Congestion,BBO-255664603,2026/04/29,tempus semper est quam pharetra magna ac consequat metus sapien ut
FERRUM PHOSPHORICUM,NZO-599979607,2025/05/19,libero convallis eget eleifend luctus ultricies eu nibh quisque id justo sit amet sapien dignissim vestibulum vestibulum
JANUVIA,SDT-183413496,2021/12/07,rutrum at lorem integer tincidunt ante vel ipsum praesent blandit lacinia erat vestibulum sed magna at nunc commodo placerat praesent
Apis Belladonna Special Order,JNS-197292811,2025/09/26,congue diam id ornare imperdiet sapien urna pretium nisl ut volutpat sapien arcu sed augue
Pepcid,GYY-100086966,2022/05/01,vestibulum ante ipsum primis in faucibus orci luctus et ultrices
CAFFEINE CITRATE,QDS-220173262,2021/08/17,augue vel accumsan tellus nisi eu orci mauris lacinia sapien quis libero nullam sit amet turpis elementum ligula vehicula consequat
Dimenhydrinate,YYW-256143149,2025/09/07,tempor convallis nulla neque libero convallis eget eleifend luctus ultricies eu nibh quisque id justo sit amet
QUETIAPINE FUMARATE,HNP-180272046,2024/01/02,porttitor lorem id ligula suspendisse ornare consequat lectus in est risus auctor sed tristique in tempus sit amet
Trazodone Hydrochloride,KBC-624469515,2025/06/09,rhoncus aliquet pulvinar sed nisl nunc rhoncus dui vel sem sed sagittis nam
The Medicine Shoppe Extra Strength Pain Relieving,STV-876574140,2024/04/11,primis in faucibus orci luctus et ultrices posuere cubilia curae donec pharetra magna
Technetium Tc99m Generator,WIK-504104500,2025/08/27,amet turpis elementum ligula vehicula consequat morbi a ipsum integer a nibh in quis justo maecenas rhoncus aliquam lacus morbi
Diaper Rash,ABQ-932969229,2024/04/06,justo maecenas rhoncus aliquam lacus morbi quis tortor id nulla
Vicks VapoDrops,BEG-313339137,2022/02/12,curae duis faucibus accumsan odio curabitur convallis duis consequat dui nec nisi volutpat eleifend donec ut dolor morbi
Cefprozil,IVO-828273710,2025/05/29,pede posuere nonummy integer non velit donec diam neque vestibulum eget vulputate ut ultrices
Cialis,EHF-969538130,2021/12/17,dolor quis odio consequat varius integer ac leo pellentesque ultrices mattis odio donec vitae nisi nam ultrices libero non
CVS ANTI ITCH,OVI-875612442,2024/05/25,proin leo odio porttitor id consequat in consequat ut nulla sed accumsan felis ut at dolor quis odio
Enalapril Maleate,WWD-263167941,2022/03/15,in porttitor pede justo eu massa donec dapibus duis at velit eu est congue elementum in hac
Cisplatin,BVV-641663381,2021/08/07,amet cursus id turpis integer aliquet massa id lobortis convallis tortor risus dapibus
Tussin,LXC-166175601,2026/05/24,ut nunc vestibulum ante ipsum primis in faucibus orci luctus et ultrices posuere
Carvedilol,KYN-887443721,2024/02/13,rutrum nulla tellus in sagittis dui vel nisl duis ac nibh fusce lacus purus aliquet at feugiat non
Walgreens Maximum Strength Sensitive Fluoride,DIG-453868082,2022/07/31,vitae consectetuer eget rutrum at lorem integer tincidunt ante vel
Night Time Original,PPM-488863139,2025/10/16,ultricies eu nibh quisque id justo sit amet sapien dignissim vestibulum vestibulum ante ipsum primis in faucibus orci luctus
Mefloquine Hydrochloride,VRS-522172719,2023/09/06,eget congue eget semper rutrum nulla nunc purus phasellus in felis
Lovastatin,JNI-954065328,2023/10/26,amet sapien dignissim vestibulum vestibulum ante ipsum primis in faucibus orci luctus et ultrices posuere cubilia curae nulla
Metoprolol Tartrate,KFS-423281758,2025/03/15,vestibulum rutrum rutrum neque aenean auctor gravida sem praesent id massa
Injury,IOL-837833237,2022/01/09,libero quis orci nullam molestie nibh in lectus pellentesque at nulla
PRENATAL CHELATED MINERAL,TTV-085811342,2024/05/07,lorem id ligula suspendisse ornare consequat lectus in est risus auctor sed tristique in tempus sit amet sem
Pier 1 Imports Sweet Cherry Anti-bacterial Hand Wash,BAV-542167754,2023/03/30,aliquam convallis nunc proin at turpis a pede posuere nonummy integer
Clonazepam,PQG-386661021,2024/11/02,donec dapibus duis at velit eu est congue elementum in hac habitasse platea dictumst morbi vestibulum velit id pretium
Oxazepam,EKA-937296025,2026/04/22,sit amet cursus id turpis integer aliquet massa id lobortis convallis tortor risus dapibus augue vel accumsan tellus nisi
Garnier Fructis Antidandruff,SPZ-842312145,2025/07/07,curabitur convallis duis consequat dui nec nisi volutpat eleifend donec ut dolor morbi vel lectus in quam
OxyContin,AIZ-711494872,2021/11/13,volutpat dui maecenas tristique est et tempus semper est quam pharetra magna ac consequat
Metoclopramide,HTV-781092809,2023/08/24,sit amet eros suspendisse accumsan tortor quis turpis sed ante vivamus tortor duis
Zolpidem Tartrate,UPD-874427445,2024/07/14,nisl nunc rhoncus dui vel sem sed sagittis nam congue risus semper porta volutpat quam
Carvedilol,BGW-084097893,2021/05/11,pharetra magna ac consequat metus sapien ut nunc vestibulum ante ipsum primis in faucibus orci luctus et
Donepezil Hydrochloride,JQF-511572524,2025/06/02,erat curabitur gravida nisi at nibh in hac habitasse platea dictumst aliquam augue quam sollicitudin
Palmers Amaranth,AOY-596490695,2021/04/13,turpis eget elit sodales scelerisque mauris sit amet eros suspendisse accumsan tortor quis turpis sed
CALC FLUOR,TEQ-188244671,2024/10/29,orci luctus et ultrices posuere cubilia curae donec pharetra magna vestibulum
stomach relief,AOW-613399732,2023/06/17,id nisl venenatis lacinia aenean sit amet justo morbi ut odio cras mi pede
Sertraline Hydrochloride,BDY-959021565,2022/01/08,molestie sed justo pellentesque viverra pede ac diam cras pellentesque volutpat dui maecenas tristique est
Sucralfate,QMF-535248147,2025/04/19,in libero ut massa volutpat convallis morbi odio odio elementum
Egg Plant,ZHT-382965979,2025/08/12,ut ultrices vel augue vestibulum ante ipsum primis in faucibus
Benztropine Mesylate,LJS-063880627,2022/12/27,ullamcorper purus sit amet nulla quisque arcu libero rutrum ac lobortis vel dapibus
Acyclovir,YJH-079498120,2021/09/18,sed ante vivamus tortor duis mattis egestas metus aenean fermentum donec ut
ADVANCED CELL BOOSTING EX BB,AAZ-690733149,2021/11/05,vestibulum velit id pretium iaculis diam erat fermentum justo nec condimentum neque sapien placerat
VENLAFAXINE HYDROCHLORIDE,MWY-758579128,2025/08/07,a libero nam dui proin leo odio porttitor id consequat in
Hydroxyzine Pamoate,ANR-764821520,2024/06/30,venenatis tristique fusce congue diam id ornare imperdiet sapien urna pretium nisl ut volutpat sapien arcu sed augue aliquam
OP Dark Tanning Xtreme Oil Amplifier SPF4,FHW-154449760,2024/08/26,donec vitae nisi nam ultrices libero non mattis pulvinar nulla pede ullamcorper augue a suscipit
Secura Extra Protective,FOX-613515936,2023/05/31,dolor sit amet consectetuer adipiscing elit proin risus praesent lectus vestibulum quam
Enoxaparin Sodium,JJP-566451817,2024/03/23,in purus eu magna vulputate luctus cum sociis natoque penatibus et magnis dis parturient montes
HYDROCHLOROTHIAZIDE,FLI-612497084,2024/01/30,rhoncus aliquet pulvinar sed nisl nunc rhoncus dui vel sem sed sagittis nam congue
Tri-Vit with Fluoride Drops,LOI-265499356,2025/04/18,orci luctus et ultrices posuere cubilia curae nulla dapibus dolor vel est donec odio justo sollicitudin
Fungicure,XBI-406823340,2024/09/03,turpis donec posuere metus vitae ipsum aliquam non mauris morbi non lectus aliquam sit amet
Fasprin,BKN-946295207,2026/05/08,turpis nec euismod scelerisque quam turpis adipiscing lorem vitae mattis nibh ligula nec sem duis aliquam convallis nunc
Rice Grain,AQP-527613011,2024/02/29,odio odio elementum eu interdum eu tincidunt in leo maecenas pulvinar lobortis
Acne Off Acne Treatment Facial,LDZ-101255358,2024/04/14,turpis eget elit sodales scelerisque mauris sit amet eros suspendisse accumsan tortor quis turpis sed ante vivamus tortor duis mattis
Glyburide and Metformin Hydrochloride,WST-551311037,2023/02/01,enim in tempor turpis nec euismod scelerisque quam turpis adipiscing lorem vitae mattis nibh ligula nec sem duis
Mineral Balancing and Energy,XAQ-885466244,2021/11/07,aliquam lacus morbi quis tortor id nulla ultrices aliquet maecenas leo odio condimentum id luctus nec molestie sed justo pellentesque
Erythrocin Stearate,RFF-834780774,2022/04/07,ipsum primis in faucibus orci luctus et ultrices posuere cubilia curae nulla dapibus dolor
Pollens - Trees, Bottle Brush Callistemon spp.,DPK-926966687,2022/06/08,convallis duis consequat dui nec nisi volutpat eleifend donec ut dolor morbi vel lectus in quam fringilla rhoncus mauris enim
Promethazine Hydrochloride,HNJ-935039211,2026/02/08,vivamus metus arcu adipiscing molestie hendrerit at vulputate vitae nisl aenean lectus pellentesque
Sunmark Pain Reliever,ZAT-068879221,2023/05/03,adipiscing elit proin risus praesent lectus vestibulum quam sapien varius ut blandit non interdum in ante vestibulum
Sulfamethoxazole and Trimethoprim,SQS-756481432,2023/06/18,in tempus sit amet sem fusce consequat nulla nisl nunc nisl duis bibendum felis sed
BenGay Vanishing Scent,KGG-021735017,2021/10/13,nibh ligula nec sem duis aliquam convallis nunc proin at turpis a pede posuere
Warfarin Sodium,OSP-509422805,2024/01/14,amet justo morbi ut odio cras mi pede malesuada in
Regemarine,MEX-261846137,2023/01/17,dis parturient montes nascetur ridiculus mus etiam vel augue vestibulum rutrum rutrum
Promethazine VC With Codeine,VSI-561424933,2024/11/02,dapibus nulla suscipit ligula in lacus curabitur at ipsum ac tellus semper interdum mauris ullamcorper purus sit amet
Cefuroxime,GLY-928347452,2024/02/05,ut dolor morbi vel lectus in quam fringilla rhoncus mauris enim leo rhoncus
Sensipar,BKE-948085511,2025/03/25,hac habitasse platea dictumst aliquam augue quam sollicitudin vitae consectetuer eget rutrum at lorem integer tincidunt
G-Tuss-NL,MIE-015529592,2021/12/31,non mauris morbi non lectus aliquam sit amet diam in magna bibendum imperdiet nullam orci
FRESH AFTER VACANCE BODY SOOTHING,ATC-306647744,2025/03/23,odio cras mi pede malesuada in imperdiet et commodo vulputate justo in blandit ultrices enim lorem ipsum dolor sit
Soothe,MGL-194761705,2021/09/21,volutpat dui maecenas tristique est et tempus semper est quam pharetra magna ac consequat metus sapien ut nunc vestibulum
Cefazolin,QHE-772400266,2025/09/13,ipsum primis in faucibus orci luctus et ultrices posuere cubilia curae donec pharetra
Fluocinonide,NBL-752160455,2021/11/09,tellus nulla ut erat id mauris vulputate elementum nullam varius nulla facilisi cras non velit
leader cough dm,VRA-973662613,2022/10/10,vitae consectetuer eget rutrum at lorem integer tincidunt ante vel ipsum praesent blandit lacinia erat
DIGOXIN,BTC-873951873,2021/07/03,aenean lectus pellentesque eget nunc donec quis orci eget orci vehicula condimentum curabitur in libero ut
Valsartan and Hydrochlorothiazide,DVK-828854330,2025/02/03,vel augue vestibulum rutrum rutrum neque aenean auctor gravida sem praesent id massa id
Nitrofurantoin Macrocrystals,ZUH-019179213,2021/05/01,ligula nec sem duis aliquam convallis nunc proin at turpis a pede posuere nonummy integer non
Fosinopril sodium,JIZ-850672346,2024/07/24,orci luctus et ultrices posuere cubilia curae mauris viverra diam vitae
ALLEROFF,PNX-972216666,2022/11/05,ac consequat metus sapien ut nunc vestibulum ante ipsum primis in faucibus orci
Ciprofloxacin,OZK-677936952,2021/08/22,nascetur ridiculus mus etiam vel augue vestibulum rutrum rutrum neque
Alka-Seltzer Plus,MUR-905307393,2024/12/30,leo rhoncus sed vestibulum sit amet cursus id turpis integer aliquet massa id lobortis convallis tortor risus dapibus
SHISEIDO RADIANT LIFTING FOUNDATION,KKP-229122885,2024/10/10,ultrices posuere cubilia curae mauris viverra diam vitae quam suspendisse potenti nullam porttitor lacus at turpis donec posuere
Acetylcysteine,QYX-335472912,2023/05/22,est congue elementum in hac habitasse platea dictumst morbi vestibulum velit id pretium iaculis diam erat
Acme Home/Office/Auto Kit,WYO-123279932,2024/10/07,maecenas tincidunt lacus at velit vivamus vel nulla eget eros elementum pellentesque
ZOLPIDEM TARTRATE,IJP-634154530,2023/10/21,urna pretium nisl ut volutpat sapien arcu sed augue aliquam erat volutpat in congue etiam justo
Prednisone,XPI-759203319,2023/10/14,amet eleifend pede libero quis orci nullam molestie nibh in lectus pellentesque at
Flavoxate Hydrochloride,TGA-106468944,2022/08/31,non lectus aliquam sit amet diam in magna bibendum imperdiet nullam
Citalopram,QDL-429736245,2021/07/09,sapien dignissim vestibulum vestibulum ante ipsum primis in faucibus orci luctus et ultrices posuere cubilia curae
Extra Strength Pain Reliever,WIG-311621972,2024/12/21,consequat varius integer ac leo pellentesque ultrices mattis odio donec vitae
Nitrous Oxide,TJY-410808177,2024/10/23,lectus aliquam sit amet diam in magna bibendum imperdiet nullam orci pede venenatis non
Y-age AEON,JAM-735480451,2026/04/01,imperdiet et commodo vulputate justo in blandit ultrices enim lorem ipsum dolor sit amet consectetuer adipiscing elit proin
Ropinirole Hydrochloride,TJJ-203459352,2021/04/10,eros suspendisse accumsan tortor quis turpis sed ante vivamus tortor duis mattis
equaline all day pain relief,BCD-559126294,2024/03/11,lectus pellentesque at nulla suspendisse potenti cras in purus eu magna vulputate luctus cum sociis natoque penatibus et magnis
Kroger Baby,LMQ-452089551,2023/06/27,adipiscing elit proin risus praesent lectus vestibulum quam sapien varius ut blandit non interdum in ante vestibulum ante
Phenazopyridine Hydrochloride,QUH-594823598,2025/10/22,quisque porta volutpat erat quisque erat eros viverra eget congue eget semper rutrum nulla nunc purus phasellus in felis
ROBAXIN,GBR-416902844,2023/11/10,tortor duis mattis egestas metus aenean fermentum donec ut mauris eget massa tempor convallis nulla neque
Baborganic Pure Energizing Skin,BYD-187185598,2026/04/05,donec pharetra magna vestibulum aliquet ultrices erat tortor sollicitudin mi sit amet lobortis sapien sapien non mi
Mydriacyl,UPU-171544811,2025/11/08,duis ac nibh fusce lacus purus aliquet at feugiat non pretium quis lectus
Antibactierial Hand Sanitizer,MLU-630101877,2022/12/06,nunc purus phasellus in felis donec semper sapien a libero nam dui proin leo odio porttitor id consequat in consequat
Resilience Lift Extreme,BFX-227942987,2024/10/11,donec odio justo sollicitudin ut suscipit a feugiat et eros vestibulum ac
Kindest Kare Antimicrobial Foaming Handwash,UAJ-667087901,2025/10/21,luctus et ultrices posuere cubilia curae duis faucibus accumsan odio curabitur convallis duis consequat dui
E-Z-Cat Dry,LDY-655888616,2023/04/30,nulla dapibus dolor vel est donec odio justo sollicitudin ut suscipit a feugiat et eros
Celazome O-Plex Control,LXN-917134749,2021/08/16,ultrices posuere cubilia curae nulla dapibus dolor vel est donec odio justo sollicitudin
Lysol,THJ-996595277,2023/11/27,ut ultrices vel augue vestibulum ante ipsum primis in faucibus orci luctus et ultrices posuere cubilia curae donec pharetra magna
Fludeoxyglucose F-18,ICZ-425301490,2022/08/29,nulla sed accumsan felis ut at dolor quis odio consequat varius
Ciprofloxacin,UWH-986514330,2024/07/31,in felis eu sapien cursus vestibulum proin eu mi nulla ac enim
Citrus and Casaba Antibacterial Hand Wash,ITX-999511867,2021/06/02,maecenas ut massa quis augue luctus tincidunt nulla mollis molestie lorem quisque ut erat curabitur gravida nisi at nibh in
Perifoam,NWV-635549466,2023/10/20,commodo vulputate justo in blandit ultrices enim lorem ipsum dolor sit amet consectetuer adipiscing elit proin
Fluticasone Propionate,XLB-272807194,2021/05/13,orci luctus et ultrices posuere cubilia curae mauris viverra diam vitae quam suspendisse potenti
Didanosine,ZVM-140665899,2024/04/20,morbi non quam nec dui luctus rutrum nulla tellus in sagittis dui vel nisl duis ac nibh fusce lacus
Dial Spring Water Antibacterial Soap,MAH-074741819,2025/09/08,condimentum curabitur in libero ut massa volutpat convallis morbi odio odio elementum eu interdum eu tincidunt in leo maecenas
Sleep-Aid,DXX-283381315,2024/08/08,erat eros viverra eget congue eget semper rutrum nulla nunc purus phasellus in
Anti-Bacterial Hand,DAO-030278295,2022/08/13,morbi vel lectus in quam fringilla rhoncus mauris enim leo rhoncus sed vestibulum sit amet cursus
IBUPROFEN,BXI-991534722,2026/04/22,metus vitae ipsum aliquam non mauris morbi non lectus aliquam
Head and Shoulders 2in1,OZV-001006763,2021/05/14,malesuada in imperdiet et commodo vulputate justo in blandit ultrices enim lorem ipsum
By Pharmicell Lab Luxury Cell Performance Toner,DEK-939696248,2025/04/22,commodo placerat praesent blandit nam nulla integer pede justo lacinia eget
Chelidonium Curcuma,NEI-475187050,2021/08/12,pretium iaculis diam erat fermentum justo nec condimentum neque sapien placerat ante nulla justo aliquam quis turpis eget elit sodales
Hydroxyzine Hydrochloride,JMG-317082199,2022/03/23,mus vivamus vestibulum sagittis sapien cum sociis natoque penatibus et magnis dis parturient montes nascetur
MediSoft,JWY-978408072,2021/12/13,integer pede justo lacinia eget tincidunt eget tempus vel pede morbi porttitor lorem id ligula suspendisse ornare
healthy accents tioconazole 1,ITN-594546127,2022/08/22,ornare imperdiet sapien urna pretium nisl ut volutpat sapien arcu sed
Plan B One-Step,ASU-136192113,2025/06/27,sed interdum venenatis turpis enim blandit mi in porttitor pede justo eu massa
Metformin Hydrochloride,YRA-887618300,2025/09/04,eu mi nulla ac enim in tempor turpis nec euismod scelerisque quam turpis
Methenamine Hippurate,EJA-655840835,2021/07/28,cum sociis natoque penatibus et magnis dis parturient montes nascetur ridiculus mus etiam
Dicyclomine Hydrochloride,OLO-817588678,2022/12/29,bibendum felis sed interdum venenatis turpis enim blandit mi in porttitor pede justo eu massa
