name,code,expiration_date,description
Atorvastatin Calcium,WLE-090994627,2021/05/22,feugiat non pretium quis lectus suspendisse potenti in eleifend quam a odio in hac habitasse platea
Sardine,CAJ-103145326,2026/04/18,lorem integer tincidunt ante vel ipsum praesent blandit lacinia erat vestibulum sed magna at nunc commodo placerat
Sorbet APF,MZU-231889943,2025/09/10,mauris laoreet ut rhoncus aliquet pulvinar sed nisl nunc rhoncus dui vel
Cefazolin Sodium,RLX-673202998,2026/03/29,mus vivamus vestibulum sagittis sapien cum sociis natoque penatibus et magnis dis
DYAZIDE,YJJ-745471446,2025/01/10,amet consectetuer adipiscing elit proin interdum mauris non ligula pellentesque ultrices phasellus id sapien in sapien iaculis congue vivamus
Rimmel London,TAX-035424883,2021/04/10,nisi eu orci mauris lacinia sapien quis libero nullam sit amet turpis elementum ligula vehicula consequat morbi a ipsum integer
Citalopram Hydrobromide,SRO-123965897,2024/12/06,mollis molestie lorem quisque ut erat curabitur gravida nisi at nibh in
Hydrocodone Bitartrate and Acetaminophen,TKT-612525755,2025/08/31,vestibulum sit amet cursus id turpis integer aliquet massa id
Protex,SOV-962846520,2026/02/11,eget vulputate ut ultrices vel augue vestibulum ante ipsum primis in faucibus orci luctus et ultrices posuere
Anti-Bacterial Hand Gel Sweet Pea,HYU-332890016,2023/04/07,sapien cum sociis natoque penatibus et magnis dis parturient montes nascetur ridiculus mus etiam vel augue
Diphenhydramine,WRN-760142961,2023/07/11,vitae ipsum aliquam non mauris morbi non lectus aliquam sit amet diam in magna bibendum imperdiet
Healing Support,EZG-208347951,2025/06/26,sit amet justo morbi ut odio cras mi pede malesuada in
Atropine Sulfate,LUJ-175739484,2026/03/25,donec quis orci eget orci vehicula condimentum curabitur in libero ut massa volutpat convallis morbi odio odio
LODOSYN,NQD-751875645,2021/09/14,phasellus id sapien in sapien iaculis congue vivamus metus arcu adipiscing molestie hendrerit at vulputate vitae nisl aenean lectus
Phenobarbital,NDD-426222379,2025/03/21,tristique fusce congue diam id ornare imperdiet sapien urna pretium nisl ut volutpat
CRYSELLE,YTB-637761601,2021/10/20,sollicitudin mi sit amet lobortis sapien sapien non mi integer ac neque duis
Gliadel,AJG-840658051,2024/01/24,sed tincidunt eu felis fusce posuere felis sed lacus morbi sem mauris
CD Dior Prestige White Collection Satin Brightening UV Base SPF 50,HQQ-589385260,2023/10/27,eu sapien cursus vestibulum proin eu mi nulla ac enim in tempor turpis nec
Infectiguard Fast Acting Antiseptic Hand Sanitizer,QST-068608262,2022/05/28,fringilla rhoncus mauris enim leo rhoncus sed vestibulum sit amet cursus id turpis integer aliquet massa
Atenolol,USZ-837909986,2022/07/14,mauris laoreet ut rhoncus aliquet pulvinar sed nisl nunc rhoncus dui vel sem sed sagittis nam
SohMed Alertness Aid,SVC-326321919,2023/03/22,semper est quam pharetra magna ac consequat metus sapien ut nunc vestibulum ante ipsum primis in
SHISEIDO FUTURE SOLUTION LX DAYTIME PROTECTIVE,AST-667073175,2025/10/14,auctor sed tristique in tempus sit amet sem fusce consequat nulla nisl nunc nisl
Diltiazem HydrochlorideExtended Release,RUY-072433993,2026/05/29,accumsan felis ut at dolor quis odio consequat varius integer ac leo pellentesque ultrices mattis odio donec
NITROGLYCERIN,WGC-991740835,2021/07/15,vehicula condimentum curabitur in libero ut massa volutpat convallis morbi odio odio elementum
CALCAREA CARBONICA,BOU-317526994,2025/12/27,sem praesent id massa id nisl venenatis lacinia aenean sit
Hydrocodone Bitartrate and Acetaminophen,GPH-262920073,2021/09/17,viverra pede ac diam cras pellentesque volutpat dui maecenas tristique est et tempus semper
Diltiazem Hydrochloride,LQV-207784197,2022/10/17,consequat nulla nisl nunc nisl duis bibendum felis sed interdum venenatis turpis
Citrus Cydonia 7,PXJ-149517266,2026/05/19,etiam faucibus cursus urna ut tellus nulla ut erat id mauris vulputate elementum nullam varius nulla facilisi cras non
Naratriptan,IXF-978989892,2024/11/26,libero nam dui proin leo odio porttitor id consequat in consequat
topcare enema,MMF-423339356,2023/06/12,vitae quam suspendisse potenti nullam porttitor lacus at turpis donec posuere metus vitae ipsum
ACULAR,ZVN-380915133,2024/03/01,libero nam dui proin leo odio porttitor id consequat in
Belladonna,FQK-196328976,2025/06/27,volutpat erat quisque erat eros viverra eget congue eget semper rutrum nulla nunc purus phasellus in felis donec semper sapien
Diltiazem Hydrochloride,TDK-872505041,2021/12/25,cubilia curae nulla dapibus dolor vel est donec odio justo sollicitudin ut suscipit a feugiat
metoprolol succinate,BQU-269212589,2023/09/11,fermentum justo nec condimentum neque sapien placerat ante nulla justo aliquam quis turpis eget elit sodales scelerisque
Sotalol Hydrochloride,PRC-476486264,2021/04/25,suscipit a feugiat et eros vestibulum ac est lacinia nisi venenatis tristique fusce congue diam id ornare imperdiet
Glyburide and Metformin Hydrochloride,NNR-832541390,2023/09/12,facilisi cras non velit nec nisi vulputate nonummy maecenas tincidunt lacus at
Losartan Potassium,VTO-741037515,2021/11/15,vestibulum vestibulum ante ipsum primis in faucibus orci luctus et ultrices posuere cubilia curae nulla dapibus dolor vel est donec
Dots Asian Spice Anti-Bacterial Hand Sanitizer,CUU-937604398,2023/08/06,libero convallis eget eleifend luctus ultricies eu nibh quisque id justo sit amet sapien dignissim vestibulum
Oral Defense Fluoride Rinse,GNC-748918734,2026/04/20,auctor sed tristique in tempus sit amet sem fusce consequat nulla nisl
Anti-Bacterial Hand,NTS-844951346,2022/08/18,mauris laoreet ut rhoncus aliquet pulvinar sed nisl nunc rhoncus dui
Bumetanide,TEQ-004230095,2025/09/09,pede justo lacinia eget tincidunt eget tempus vel pede morbi porttitor lorem id ligula suspendisse ornare consequat lectus in est
Oxycodone Hydrochloride,AIR-994515698,2024/10/28,quam pede lobortis ligula sit amet eleifend pede libero quis orci nullam molestie nibh in lectus pellentesque at
MEDIQUE I-PRIN,BBV-100916043,2023/10/21,ut rhoncus aliquet pulvinar sed nisl nunc rhoncus dui vel sem sed sagittis nam congue risus
Extra Strength Pain Relief PM,GGW-187442191,2024/02/24,pede morbi porttitor lorem id ligula suspendisse ornare consequat lectus in est
Nesacaine,GLK-996901698,2022/08/25,volutpat erat quisque erat eros viverra eget congue eget semper rutrum nulla nunc purus
Mineral Ice,NDY-115173393,2025/09/26,rhoncus aliquet pulvinar sed nisl nunc rhoncus dui vel sem sed sagittis nam congue risus semper porta volutpat quam pede
Alprazolam,UBF-172769298,2026/02/09,libero non mattis pulvinar nulla pede ullamcorper augue a suscipit nulla elit ac
Viscum Pini,XNZ-881933326,2022/01/28,in hac habitasse platea dictumst etiam faucibus cursus urna ut tellus nulla ut erat id mauris vulputate
Medroxyprogesterone Acetate,GYY-896322978,2021/09/07,quis orci eget orci vehicula condimentum curabitur in libero ut massa volutpat convallis morbi odio
Metformin Hydrochloride,FKX-425329553,2024/07/28,vulputate vitae nisl aenean lectus pellentesque eget nunc donec quis
leader tussin dm,SJB-834454866,2024/11/29,fermentum justo nec condimentum neque sapien placerat ante nulla justo
SINGULAIR,FUW-238359931,2025/06/09,habitasse platea dictumst morbi vestibulum velit id pretium iaculis diam erat fermentum justo nec condimentum neque sapien
TABLOID,RXT-122981937,2023/01/01,quis augue luctus tincidunt nulla mollis molestie lorem quisque ut erat curabitur gravida nisi at nibh in hac habitasse platea
Cyproheptadine Hydrochloride,JOP-083290408,2023/02/08,at ipsum ac tellus semper interdum mauris ullamcorper purus sit amet nulla quisque arcu libero rutrum ac lobortis vel
Metaxalone,BCA-283631420,2025/07/27,lacinia sapien quis libero nullam sit amet turpis elementum ligula vehicula consequat
Sore Throat Spray Cherry,OEW-655993967,2024/01/27,ut massa volutpat convallis morbi odio odio elementum eu interdum eu tincidunt in leo maecenas pulvinar lobortis est phasellus
ropinirole hydrochloride,DXV-512044351,2026/04/10,faucibus accumsan odio curabitur convallis duis consequat dui nec nisi volutpat eleifend donec ut dolor morbi vel lectus in
CAVIA PORCELLUS SKIN,LJH-299338393,2026/03/29,vestibulum sit amet cursus id turpis integer aliquet massa id lobortis convallis tortor risus dapibus augue vel accumsan
Captopril,QXI-667441560,2021/10/03,eros elementum pellentesque quisque porta volutpat erat quisque erat eros viverra eget congue eget semper
Sterile Vancomycin Hydrochloride,QZE-569364161,2026/01/18,habitasse platea dictumst aliquam augue quam sollicitudin vitae consectetuer eget rutrum at lorem integer tincidunt ante vel ipsum praesent
Norpace,KGM-350845495,2021/08/20,semper porta volutpat quam pede lobortis ligula sit amet eleifend pede libero quis orci nullam molestie nibh
PULMICORT RESPULES,ZSM-919475205,2021/04/20,amet sapien dignissim vestibulum vestibulum ante ipsum primis in faucibus orci luctus et ultrices posuere cubilia curae nulla dapibus
Nite-Time,LYG-779404917,2025/02/14,curabitur convallis duis consequat dui nec nisi volutpat eleifend donec
Anxiety II HP,NEB-296738971,2026/03/07,magna bibendum imperdiet nullam orci pede venenatis non sodales sed tincidunt
Sooryehan Pure-Whitening Essence,ZQH-771090075,2022/03/06,lacus at velit vivamus vel nulla eget eros elementum pellentesque quisque porta volutpat erat quisque erat eros
Fluoxetine,FYJ-689164269,2023/10/29,tellus nisi eu orci mauris lacinia sapien quis libero nullam sit amet turpis elementum ligula vehicula consequat morbi a ipsum
SINGULAIR,IZY-337340797,2023/05/21,nullam sit amet turpis elementum ligula vehicula consequat morbi a ipsum integer a
Demeclocycline Hydrochloride,VRV-025893478,2023/08/05,aliquam convallis nunc proin at turpis a pede posuere nonummy integer non velit donec diam neque vestibulum eget vulputate ut
Allergy,VLE-692404420,2024/05/10,a suscipit nulla elit ac nulla sed vel enim sit amet
Carelessweed,VDJ-980164787,2025/04/11,eget massa tempor convallis nulla neque libero convallis eget eleifend
Fluorouracil,AVP-105875472,2022/02/08,cubilia curae duis faucibus accumsan odio curabitur convallis duis consequat dui nec nisi
PHYTOGENIC INFINITE POWDER FOUNDATION,KLL-986165181,2025/07/09,rhoncus sed vestibulum sit amet cursus id turpis integer aliquet massa id lobortis convallis tortor risus dapibus
Methocarbamol,ALL-649684896,2023/07/31,id nulla ultrices aliquet maecenas leo odio condimentum id luctus nec
Menstrual Pain Relief,IZA-773355255,2025/12/15,faucibus orci luctus et ultrices posuere cubilia curae nulla dapibus dolor
Saltbush,YEP-198616086,2024/08/03,donec diam neque vestibulum eget vulputate ut ultrices vel augue vestibulum ante ipsum primis in faucibus orci luctus et ultrices
Bactestat,GBK-346898318,2023/08/25,nec molestie sed justo pellentesque viverra pede ac diam cras pellentesque volutpat dui maecenas tristique
Ketek,BPP-362681052,2023/02/12,lacus curabitur at ipsum ac tellus semper interdum mauris ullamcorper purus sit amet nulla quisque arcu
PROSCAR,DOA-265980755,2021/08/15,cubilia curae donec pharetra magna vestibulum aliquet ultrices erat tortor sollicitudin mi
Fludeoxyglucose F18,MMX-082878930,2023/10/28,mus etiam vel augue vestibulum rutrum rutrum neque aenean auctor gravida sem praesent id massa id
Equate Nicotine,ZDY-819571096,2024/06/01,volutpat erat quisque erat eros viverra eget congue eget semper rutrum nulla
Relpax,XNG-370955106,2022/08/08,fusce congue diam id ornare imperdiet sapien urna pretium nisl ut volutpat sapien arcu sed augue aliquam erat volutpat
Docusate Sodium,SHD-386250671,2025/08/18,faucibus accumsan odio curabitur convallis duis consequat dui nec nisi volutpat eleifend donec ut dolor morbi vel lectus in quam
Dextroamphetamine Saccharate, Amphetamine Aspartate Monohydrate, Dextroamphetamine Sulfate and Amphetamine Sulfate,AUK-930734630,2025/01/16,a suscipit nulla elit ac nulla sed vel enim sit amet nunc viverra dapibus nulla suscipit ligula
DENBLAN,BXP-923889378,2025/01/24,et ultrices posuere cubilia curae duis faucibus accumsan odio curabitur convallis duis consequat dui nec nisi volutpat eleifend donec
Prednisone,LXM-682498899,2026/04/11,turpis a pede posuere nonummy integer non velit donec diam neque vestibulum eget vulputate
biclora,IKB-333193528,2021/07/13,ultrices phasellus id sapien in sapien iaculis congue vivamus metus arcu
Canadian Bluegrass,QNS-898853031,2023/02/27,neque duis bibendum morbi non quam nec dui luctus rutrum nulla tellus in sagittis dui vel
Sunscreen Day SPF 50,JHM-361787690,2024/05/18,pellentesque ultrices mattis odio donec vitae nisi nam ultrices libero non mattis pulvinar nulla pede ullamcorper augue a suscipit nulla
OPANA,GAG-601263795,2024/08/01,aliquam erat volutpat in congue etiam justo etiam pretium iaculis justo in
Tekamlo,QKW-777859005,2023/11/29,consequat ut nulla sed accumsan felis ut at dolor quis odio
BOOST REGROWTH FOR WOMEN,JBR-053421765,2021/07/11,quis tortor id nulla ultrices aliquet maecenas leo odio condimentum id luctus nec molestie sed justo pellentesque viverra pede
Warfarin Sodium,XJQ-605429630,2023/08/02,luctus nec molestie sed justo pellentesque viverra pede ac diam cras pellentesque volutpat dui maecenas tristique
Vancomycin Hydrochloride,DCG-160380231,2024/06/07,libero ut massa volutpat convallis morbi odio odio elementum eu interdum eu tincidunt in leo maecenas pulvinar lobortis
Marqibo,WXG-856939041,2025/02/20,dis parturient montes nascetur ridiculus mus vivamus vestibulum sagittis sapien cum sociis natoque penatibus et magnis dis parturient montes nascetur
Xyntha,HGA-831831448,2022/07/25,laoreet ut rhoncus aliquet pulvinar sed nisl nunc rhoncus dui vel sem sed sagittis nam congue risus
AMARYL,BWB-488792805,2025/02/17,pellentesque viverra pede ac diam cras pellentesque volutpat dui maecenas tristique est et tempus semper est quam pharetra magna ac
Lisinopril,VGE-363098264,2025/08/07,donec odio justo sollicitudin ut suscipit a feugiat et eros vestibulum ac est
Sildenafil,FYY-880536525,2021/11/02,id ornare imperdiet sapien urna pretium nisl ut volutpat sapien arcu sed augue aliquam erat volutpat
Systane Ultra,PWL-243096712,2025/06/23,mauris vulputate elementum nullam varius nulla facilisi cras non velit nec nisi vulputate nonummy maecenas tincidunt lacus
Nicotine Polacrilex, Coated Fruit Flavor,XSV-541144124,2023/08/12,turpis enim blandit mi in porttitor pede justo eu massa donec dapibus duis at velit eu est congue
Lidocaine Hydrochloride and Epinephrine Bitartrate,ZWH-715206798,2026/03/22,ut blandit non interdum in ante vestibulum ante ipsum primis
OXYGEN,LAV-525258548,2025/11/16,massa donec dapibus duis at velit eu est congue elementum in hac habitasse
Bangs Scrapes,RJE-129838459,2025/02/06,quam a odio in hac habitasse platea dictumst maecenas ut massa quis augue luctus tincidunt nulla mollis
Gabapentin,OSF-110820652,2023/05/28,in faucibus orci luctus et ultrices posuere cubilia curae nulla dapibus
AHAVA ACTIVE DEADSEA MINERALS,ZWU-212389558,2022/06/23,aliquam erat volutpat in congue etiam justo etiam pretium iaculis justo
cough and chest congestion dm max,WEU-753214684,2023/08/28,in faucibus orci luctus et ultrices posuere cubilia curae donec pharetra magna vestibulum aliquet ultrices erat tortor sollicitudin mi
SoonSoo gargle,XZK-461263235,2022/06/18,suscipit nulla elit ac nulla sed vel enim sit amet nunc viverra dapibus nulla suscipit
Premier Value Antacid and Pain Relief Medicine,XHG-317152976,2026/04/07,ut ultrices vel augue vestibulum ante ipsum primis in faucibus orci
Lancome Paris,SQJ-079156192,2026/01/31,pede ac diam cras pellentesque volutpat dui maecenas tristique est et tempus semper est quam pharetra magna
good sense pain relief,THZ-543796619,2024/02/26,sit amet erat nulla tempus vivamus in felis eu sapien cursus
SODIUM SULFACETAMIDE AND SULFUR,ZSY-788744111,2026/01/10,neque vestibulum eget vulputate ut ultrices vel augue vestibulum ante ipsum primis
Sterile Water,FJE-669762879,2021/07/17,sapien ut nunc vestibulum ante ipsum primis in faucibus orci luctus et ultrices
topcare flu and severe cold and cough,ATK-871653347,2024/03/24,in quis justo maecenas rhoncus aliquam lacus morbi quis tortor id nulla ultrices aliquet maecenas leo
Heparin Sodium,ZEA-035372655,2022/12/11,pede malesuada in imperdiet et commodo vulputate justo in blandit
good neighbor pharmacy nicotine,DSE-497553779,2021/04/23,aenean fermentum donec ut mauris eget massa tempor convallis nulla neque libero
Nurture Skin Repair,NRG-275174735,2022/07/06,justo morbi ut odio cras mi pede malesuada in imperdiet et commodo vulputate justo in
Pollens - Weeds and Garden Plants, Plantain, English Plantago lanceolata,OQS-793766612,2026/04/09,blandit nam nulla integer pede justo lacinia eget tincidunt eget tempus vel pede morbi porttitor lorem id
Pumpkin Anti-bacterial foaming Hand Wash,VRH-266152602,2023/06/28,quam pharetra magna ac consequat metus sapien ut nunc vestibulum ante ipsum primis in faucibus orci luctus et ultrices
Handi Sani,FPU-655822978,2026/02/28,hendrerit at vulputate vitae nisl aenean lectus pellentesque eget nunc donec quis orci eget orci
Micardis,GGS-766543624,2023/08/28,vivamus metus arcu adipiscing molestie hendrerit at vulputate vitae nisl aenean lectus pellentesque eget nunc donec quis orci eget orci
Depo-Medrol,DIF-092493108,2026/01/03,dui maecenas tristique est et tempus semper est quam pharetra magna ac consequat metus sapien ut
Carbamazepine,LCJ-650816969,2024/11/18,in libero ut massa volutpat convallis morbi odio odio elementum eu interdum eu tincidunt in leo maecenas pulvinar
Equate Tussin DM Max,EEN-342649105,2022/11/23,condimentum curabitur in libero ut massa volutpat convallis morbi odio odio elementum eu
Magnesium Sulfate,IQE-274624402,2026/03/19,eu sapien cursus vestibulum proin eu mi nulla ac enim in tempor turpis nec euismod scelerisque quam turpis adipiscing
VECURONIUM BROMIDE,MYA-722045976,2023/08/26,etiam pretium iaculis justo in hac habitasse platea dictumst etiam faucibus cursus urna ut tellus nulla ut
METFORMIN HYDROCHLORIDE,IHM-389000429,2022/08/30,nulla dapibus dolor vel est donec odio justo sollicitudin ut suscipit a feugiat et eros
Furosemide,MZG-482507665,2022/01/05,cubilia curae donec pharetra magna vestibulum aliquet ultrices erat tortor sollicitudin
EZ Nite Sleep,BOV-258219128,2023/03/21,ultrices enim lorem ipsum dolor sit amet consectetuer adipiscing elit proin interdum mauris non ligula pellentesque ultrices phasellus id sapien
Bronchial Cough,ZUP-292425618,2023/01/17,venenatis lacinia aenean sit amet justo morbi ut odio cras mi pede malesuada
EARACHE KIDS RELIEF,PUF-395665166,2024/08/09,consequat varius integer ac leo pellentesque ultrices mattis odio donec vitae nisi nam ultrices libero
Dronabinol,CQE-724355384,2023/05/11,leo pellentesque ultrices mattis odio donec vitae nisi nam ultrices libero non mattis pulvinar nulla pede
Elite Natural SPF 30,LQR-753201504,2021/11/10,convallis duis consequat dui nec nisi volutpat eleifend donec ut dolor morbi
Amlodipine and Benazepril Hydrochloride,FTY-112739403,2024/04/12,sollicitudin vitae consectetuer eget rutrum at lorem integer tincidunt ante vel ipsum praesent blandit lacinia
MARLISSA,JRI-245765622,2022/01/18,tortor duis mattis egestas metus aenean fermentum donec ut mauris eget massa tempor convallis nulla neque
SOMA Croim,BZU-874817062,2022/07/22,at ipsum ac tellus semper interdum mauris ullamcorper purus sit amet
TIZANIDINE,ZMQ-006287383,2025/05/01,semper rutrum nulla nunc purus phasellus in felis donec semper sapien a libero nam dui proin leo odio porttitor
Pioglitazone and metformin,UPS-311865710,2022/01/19,dapibus duis at velit eu est congue elementum in hac habitasse platea dictumst morbi vestibulum velit id
Acetylcysteine,RXM-781795232,2025/08/14,odio consequat varius integer ac leo pellentesque ultrices mattis odio donec vitae nisi nam ultrices libero non mattis pulvinar
NHS Rheumatism,VQI-375649632,2021/10/13,ligula vehicula consequat morbi a ipsum integer a nibh in quis justo maecenas rhoncus
Epoprostenol Sodium,XAO-890380142,2026/02/28,adipiscing elit proin risus praesent lectus vestibulum quam sapien varius ut blandit non interdum in
Nystatin,GQQ-777163536,2022/05/28,orci nullam molestie nibh in lectus pellentesque at nulla suspendisse potenti
ANNA LOTAN Rejuvenating Day Broad Spectrum SPF 34,UJQ-029175582,2024/10/17,hac habitasse platea dictumst morbi vestibulum velit id pretium iaculis diam erat
Pain Relief,WVR-931646027,2023/08/21,justo sit amet sapien dignissim vestibulum vestibulum ante ipsum primis in faucibus orci luctus et ultrices posuere cubilia
Extra Strength Pain Relief,GQU-329765089,2022/05/03,at ipsum ac tellus semper interdum mauris ullamcorper purus sit
Topcare Headache PM Formula,CFU-297780344,2021/09/05,vestibulum ante ipsum primis in faucibus orci luctus et ultrices posuere cubilia curae donec pharetra magna vestibulum aliquet ultrices
Rest Simply,XUT-912766622,2023/02/27,euismod scelerisque quam turpis adipiscing lorem vitae mattis nibh ligula nec sem
Treatment Set TS344558,ABS-500856775,2024/11/07,augue luctus tincidunt nulla mollis molestie lorem quisque ut erat curabitur gravida nisi at nibh in hac habitasse platea dictumst
LBEL REPLENISHING FOUNDATION SPF 14,UNH-597198741,2022/11/15,neque vestibulum eget vulputate ut ultrices vel augue vestibulum ante ipsum primis in faucibus orci luctus
Pedia-Lax,PYP-844421887,2022/07/26,in faucibus orci luctus et ultrices posuere cubilia curae mauris viverra diam vitae quam suspendisse potenti
Good Neighbor Pharmacy Sleep Aid,DSU-232730947,2026/01/29,nulla dapibus dolor vel est donec odio justo sollicitudin ut suscipit a feugiat et
ISOVUE,TXP-395209791,2026/04/23,amet lobortis sapien sapien non mi integer ac neque duis bibendum morbi non quam nec dui luctus rutrum
AVAR,FBY-231776060,2021/05/12,cursus id turpis integer aliquet massa id lobortis convallis tortor risus
DryMax,VFN-418024511,2023/11/09,quisque id justo sit amet sapien dignissim vestibulum vestibulum ante ipsum primis
Zonatuss,QZE-491851780,2026/04/25,ullamcorper purus sit amet nulla quisque arcu libero rutrum ac lobortis vel dapibus at diam nam tristique
Crest,WDU-832044677,2024/04/21,vitae nisi nam ultrices libero non mattis pulvinar nulla pede ullamcorper augue a suscipit nulla elit ac nulla sed
enMotion High Frequency Foam Hand Sanitizer,SUE-865355086,2021/10/25,nunc proin at turpis a pede posuere nonummy integer non velit donec
SohMed Pain Reliever,IXS-049632498,2021/07/30,in quam fringilla rhoncus mauris enim leo rhoncus sed vestibulum
Clindamycin - Benzoyl Peroxide,CSQ-069977851,2021/04/23,mauris vulputate elementum nullam varius nulla facilisi cras non velit nec nisi vulputate nonummy maecenas tincidunt lacus at velit vivamus
Trifluoperazine Hydrochloride,IIL-775305788,2025/12/29,metus vitae ipsum aliquam non mauris morbi non lectus aliquam sit amet diam in magna
LBEL MAXIMUM COMFORT AND LONG-LASTING FOUNDATION SPF 10,NTI-987181426,2025/03/20,sem mauris laoreet ut rhoncus aliquet pulvinar sed nisl nunc rhoncus
ck one airlight pressed powder spf 15,TOD-131825238,2022/12/24,tortor id nulla ultrices aliquet maecenas leo odio condimentum id luctus nec molestie sed justo pellentesque viverra pede ac
triple antibiotic,EWG-515564491,2024/06/16,vitae quam suspendisse potenti nullam porttitor lacus at turpis donec posuere metus vitae ipsum aliquam non mauris morbi
Blemish Buster,DDA-375345451,2022/06/14,ante ipsum primis in faucibus orci luctus et ultrices posuere cubilia curae nulla dapibus dolor vel est donec odio justo
OXYGEN,BPB-599674857,2026/05/13,tincidunt lacus at velit vivamus vel nulla eget eros elementum pellentesque quisque porta volutpat erat
Clario Instant Hand Sanitizer,CNM-983082939,2025/05/24,ornare consequat lectus in est risus auctor sed tristique in tempus sit amet sem fusce consequat nulla
kaiser permanente benzoyl peroxide,MGX-716390797,2023/04/14,tristique est et tempus semper est quam pharetra magna ac
EQUALIZER,LXW-121825625,2021/07/31,ultrices mattis odio donec vitae nisi nam ultrices libero non mattis pulvinar nulla pede ullamcorper
Neutrogena Ultra Sheer Body Mist Sunscreen,PLT-094143946,2021/07/14,porta volutpat quam pede lobortis ligula sit amet eleifend pede libero
Bupropion Hydrochloride,PYI-524927381,2023/07/31,diam cras pellentesque volutpat dui maecenas tristique est et tempus semper est quam pharetra magna ac consequat metus sapien ut
AcetaZOLAMIDE,CKC-077631533,2023/09/18,praesent lectus vestibulum quam sapien varius ut blandit non interdum in ante vestibulum ante ipsum primis in faucibus orci luctus
Imipramine Hydrochloride,JAZ-051553042,2023/07/08,non pretium quis lectus suspendisse potenti in eleifend quam a odio in hac habitasse platea
Depo-Testosterone,OQV-022580853,2021/08/21,duis bibendum felis sed interdum venenatis turpis enim blandit mi in porttitor pede justo eu massa donec dapibus duis
LOESTRIN Fe 1/20,INZ-290338104,2024/06/06,proin eu mi nulla ac enim in tempor turpis nec euismod scelerisque quam
Tretinoin,BPT-022473360,2021/09/20,magna bibendum imperdiet nullam orci pede venenatis non sodales sed tincidunt eu felis fusce posuere felis sed lacus morbi
HOLCUS LANATUS POLLEN,VRP-091710382,2026/04/13,non lectus aliquam sit amet diam in magna bibendum imperdiet nullam orci pede venenatis non sodales sed
Sinus and Allergy PE,DOE-369727331,2024/12/06,in felis donec semper sapien a libero nam dui proin leo odio porttitor id consequat in consequat
Propoxyphene and Acetaminophen,KBL-200471571,2023/10/06,accumsan tellus nisi eu orci mauris lacinia sapien quis libero nullam sit amet turpis elementum ligula vehicula
Everyday Clean,UKJ-188417431,2022/02/25,lacinia sapien quis libero nullam sit amet turpis elementum ligula vehicula consequat morbi a ipsum integer a nibh in
Loratadine,ZOM-824152524,2022/11/02,sodales scelerisque mauris sit amet eros suspendisse accumsan tortor quis turpis
