name,code,expiration_date,description
Dawn,BRA-133556327,2021/10/11,augue a suscipit nulla elit ac nulla sed vel enim sit amet nunc viverra dapibus nulla
Aveeno Active Naturals Positively Ageless Youth Perfecting Moisturizer,IXB-608444391,2022/12/21,in felis eu sapien cursus vestibulum proin eu mi nulla ac enim in tempor turpis nec euismod scelerisque quam turpis
Metoprolol Succinate,SIN-558836948,2026/03/05,nulla tellus in sagittis dui vel nisl duis ac nibh fusce lacus purus aliquet at
Ciprofloxacin,QVD-287693816,2022/09/21,ultrices phasellus id sapien in sapien iaculis congue vivamus metus arcu adipiscing molestie hendrerit at
AMSure,FKL-703550420,2023/06/29,vivamus vel nulla eget eros elementum pellentesque quisque porta volutpat erat quisque erat eros viverra eget congue eget semper rutrum
Moore Medical Extra Strength Non Aspirin,KQF-323010400,2023/11/14,sed justo pellentesque viverra pede ac diam cras pellentesque volutpat dui maecenas
NYSTATIN,SLK-850055880,2023/07/01,venenatis tristique fusce congue diam id ornare imperdiet sapien urna pretium nisl ut volutpat sapien arcu sed augue
Metronidazole,DQL-166131689,2023/02/04,luctus ultricies eu nibh quisque id justo sit amet sapien dignissim vestibulum
Rimmel London,VVQ-549584678,2021/08/23,nisi nam ultrices libero non mattis pulvinar nulla pede ullamcorper augue a suscipit nulla elit
Fungal Plus,AEQ-199357075,2026/03/16,vel enim sit amet nunc viverra dapibus nulla suscipit ligula in
Extra Strength QPAP,XCY-789787060,2024/06/03,mauris laoreet ut rhoncus aliquet pulvinar sed nisl nunc rhoncus dui vel sem sed
Loratadine,JKJ-702412157,2021/08/17,id sapien in sapien iaculis congue vivamus metus arcu adipiscing molestie hendrerit at vulputate vitae nisl
Prevacid,AJW-366198446,2024/04/01,nisi vulputate nonummy maecenas tincidunt lacus at velit vivamus vel nulla eget eros elementum pellentesque
esika,QXL-799524905,2021/08/13,vestibulum ante ipsum primis in faucibus orci luctus et ultrices posuere cubilia curae mauris viverra diam vitae
Lisinopril,ZPT-278180227,2021/08/09,habitasse platea dictumst maecenas ut massa quis augue luctus tincidunt nulla mollis molestie lorem quisque
Sei Bella Skin Refining Tinted Moisturizer,TGV-859205461,2022/04/14,convallis morbi odio odio elementum eu interdum eu tincidunt in leo maecenas pulvinar
Diclofenac Sodium,ESR-956499587,2022/08/10,a suscipit nulla elit ac nulla sed vel enim sit
Oxygen,KJV-247541593,2023/09/22,vulputate nonummy maecenas tincidunt lacus at velit vivamus vel nulla eget eros
Alprazolam,XHC-008403913,2023/05/14,feugiat non pretium quis lectus suspendisse potenti in eleifend quam a odio in
Lamotrigine,XEM-789164869,2026/04/07,vulputate nonummy maecenas tincidunt lacus at velit vivamus vel nulla eget eros elementum pellentesque quisque porta volutpat erat
Erborian BB Creme Au Ginseng Dore,SDS-221792679,2024/08/03,nulla justo aliquam quis turpis eget elit sodales scelerisque mauris sit amet
Childrens Allergy,ICC-089241074,2024/03/24,tempus semper est quam pharetra magna ac consequat metus sapien ut nunc vestibulum ante ipsum primis in faucibus
Olanzapine,JLH-976768796,2022/09/16,lacinia erat vestibulum sed magna at nunc commodo placerat praesent blandit nam
Treatment Set TS345268,AOK-984894554,2021/05/11,morbi quis tortor id nulla ultrices aliquet maecenas leo odio condimentum id luctus
Flumazenil,DUK-617897012,2024/06/27,mi sit amet lobortis sapien sapien non mi integer ac neque duis bibendum morbi non quam nec dui luctus
ONDANSETRON HYDROCHLORIDE,GYG-061266288,2022/04/28,rhoncus aliquet pulvinar sed nisl nunc rhoncus dui vel sem sed
Childrens Acetaminophen,RLB-345374951,2021/11/30,massa id nisl venenatis lacinia aenean sit amet justo morbi ut odio cras mi pede
CD DIORSKIN STAR Studio Makeup Spectacular Brightening with sunscreen Broad Spectrum SPF30 032,IRF-320493465,2024/04/22,diam cras pellentesque volutpat dui maecenas tristique est et tempus semper
Calloused,NRL-357483267,2026/02/20,luctus et ultrices posuere cubilia curae duis faucibus accumsan odio curabitur convallis duis consequat
Adderall,MRZ-286218187,2023/12/15,leo pellentesque ultrices mattis odio donec vitae nisi nam ultrices libero non mattis pulvinar nulla pede ullamcorper augue a suscipit
Fentanyl,EFB-524719262,2021/08/31,nonummy integer non velit donec diam neque vestibulum eget vulputate ut ultrices vel augue vestibulum ante ipsum
Tamsulosin Hydrochloride,BBA-828226225,2025/07/09,erat quisque erat eros viverra eget congue eget semper rutrum nulla
SinuClean,SLH-437669447,2026/02/10,tempus vivamus in felis eu sapien cursus vestibulum proin eu
Eucalyptus,XCM-279843423,2021/07/28,amet sem fusce consequat nulla nisl nunc nisl duis bibendum felis sed interdum venenatis
Medium Deep Foundation SPF 15,JAD-701742518,2022/09/16,morbi non quam nec dui luctus rutrum nulla tellus in sagittis dui vel nisl duis ac nibh fusce lacus
CitraNatal Rx,RRS-139585640,2023/07/26,eleifend luctus ultricies eu nibh quisque id justo sit amet sapien dignissim vestibulum vestibulum ante ipsum primis
Childrens Chewable Acetaminophen,OBG-284786887,2021/08/29,ullamcorper augue a suscipit nulla elit ac nulla sed vel enim sit amet nunc
3 CONCEPT EYES SLIM FIT PACT SOFT BEIGE,XOH-160796465,2026/03/03,iaculis justo in hac habitasse platea dictumst etiam faucibus cursus urna ut tellus nulla ut erat id mauris
Dexmethylphenidate hydrochloride,ALJ-173461241,2022/01/31,aliquam lacus morbi quis tortor id nulla ultrices aliquet maecenas leo odio condimentum id luctus nec molestie sed justo pellentesque
Low Dose Aspirin,GBO-569412678,2026/01/07,sit amet nunc viverra dapibus nulla suscipit ligula in lacus curabitur at ipsum ac tellus semper
LATANOPROST,UCC-070884855,2023/07/27,a suscipit nulla elit ac nulla sed vel enim sit
Phenobarbital,ZHP-316333415,2025/04/04,aliquam lacus morbi quis tortor id nulla ultrices aliquet maecenas leo odio
Kalium aceticum comp. 6,BOV-169814537,2023/10/27,vulputate ut ultrices vel augue vestibulum ante ipsum primis in faucibus orci luctus et ultrices posuere
Vyvanse,ITG-013884607,2024/03/27,vehicula consequat morbi a ipsum integer a nibh in quis justo maecenas rhoncus aliquam lacus
Rye Grass, Perennial Standardized,DGJ-575921925,2023/04/13,sem praesent id massa id nisl venenatis lacinia aenean sit amet justo morbi ut odio cras mi pede
Hydrogen Peroxide,SGC-258073342,2023/01/16,penatibus et magnis dis parturient montes nascetur ridiculus mus vivamus
Neuac Kit,WWX-033732976,2023/07/20,tincidunt eget tempus vel pede morbi porttitor lorem id ligula suspendisse ornare consequat
Prilocaine Hydrochloride with Epinephrine,LOE-687234348,2025/07/11,imperdiet nullam orci pede venenatis non sodales sed tincidunt eu felis fusce posuere
SE 10-5 SS,LAC-763606163,2024/10/24,tincidunt lacus at velit vivamus vel nulla eget eros elementum pellentesque quisque porta volutpat
Ramipril,WMB-693027682,2021/07/13,eget semper rutrum nulla nunc purus phasellus in felis donec
Chamomilla Cupro 3 Special Order,OYL-037175078,2026/03/18,eleifend pede libero quis orci nullam molestie nibh in lectus pellentesque
Flumazenil,TER-371960284,2024/03/11,sociis natoque penatibus et magnis dis parturient montes nascetur ridiculus mus vivamus vestibulum
Aire-Master,FUY-354560361,2024/12/01,cras non velit nec nisi vulputate nonummy maecenas tincidunt lacus at velit vivamus vel
SMART SENSE Hydrogen Peroxide,IAJ-247861835,2021/11/17,dui maecenas tristique est et tempus semper est quam pharetra magna ac consequat metus sapien
Rite Aid RENEWAL,MNX-516722021,2024/09/19,pede ac diam cras pellentesque volutpat dui maecenas tristique est et tempus semper est quam pharetra magna ac
Sani-Smooth,BHX-047514922,2024/07/31,iaculis diam erat fermentum justo nec condimentum neque sapien placerat
Theophylline,WGW-269428654,2025/01/01,enim in tempor turpis nec euismod scelerisque quam turpis adipiscing lorem vitae
Vichy Laboratoire,SIC-034145728,2023/11/27,nibh ligula nec sem duis aliquam convallis nunc proin at turpis a
RITE AID RENEWAL,CIW-348104098,2024/12/26,amet diam in magna bibendum imperdiet nullam orci pede venenatis non
Loratadine,HSY-413790848,2022/11/20,dui vel nisl duis ac nibh fusce lacus purus aliquet at feugiat non pretium quis lectus suspendisse potenti in
Microgestin,KBZ-102413910,2023/07/21,amet consectetuer adipiscing elit proin interdum mauris non ligula pellentesque ultrices phasellus id sapien
Isosorbide,RAW-071676241,2025/09/12,porttitor pede justo eu massa donec dapibus duis at velit eu est congue elementum in hac habitasse
Clear Defense,PTB-707926041,2025/02/16,nibh in quis justo maecenas rhoncus aliquam lacus morbi quis tortor id
Cephalexin,KKO-457638329,2024/03/24,a ipsum integer a nibh in quis justo maecenas rhoncus aliquam lacus morbi quis
Enlon Plus,VGZ-316385345,2021/06/20,nunc rhoncus dui vel sem sed sagittis nam congue risus semper porta volutpat
Rite Aid,GRG-272057039,2024/04/18,amet consectetuer adipiscing elit proin risus praesent lectus vestibulum quam sapien
PASPALUM NOTATUM POLLEN,QJE-660049759,2025/12/17,nisi vulputate nonummy maecenas tincidunt lacus at velit vivamus vel nulla eget eros elementum pellentesque
Cyclobenzaprine Hydrochloride,RSK-038049316,2023/02/06,posuere cubilia curae donec pharetra magna vestibulum aliquet ultrices erat tortor sollicitudin mi sit amet lobortis sapien sapien non
Venlafaxine Hydrochloride,PCO-544111727,2025/10/04,semper est quam pharetra magna ac consequat metus sapien ut nunc vestibulum ante
MUCOR PLUMBEUS,ANQ-477282379,2025/10/16,ultrices aliquet maecenas leo odio condimentum id luctus nec molestie
Eczema - Skin Care,QXE-137865147,2022/04/01,erat quisque erat eros viverra eget congue eget semper rutrum
Alba TerraTint Bloom SPF 15 Lip Balm,EQK-505144976,2021/04/30,placerat ante nulla justo aliquam quis turpis eget elit sodales scelerisque mauris sit amet eros suspendisse accumsan tortor
Acarbose,TVI-343128701,2025/06/26,sit amet turpis elementum ligula vehicula consequat morbi a ipsum
Etodolac,BCM-064575819,2023/12/11,lorem ipsum dolor sit amet consectetuer adipiscing elit proin risus praesent lectus
Miconazole Nitrate,FHT-646980447,2022/02/26,sed nisl nunc rhoncus dui vel sem sed sagittis nam congue risus semper porta volutpat quam
Aceon,HAR-360539126,2021/06/21,amet sapien dignissim vestibulum vestibulum ante ipsum primis in faucibus orci luctus et
Captopril,ZDR-640615260,2024/08/22,pellentesque at nulla suspendisse potenti cras in purus eu magna vulputate luctus cum sociis natoque penatibus
Senna-S,CEE-963575902,2023/11/27,quis augue luctus tincidunt nulla mollis molestie lorem quisque ut erat curabitur gravida nisi at nibh in
Salinaax,RSW-610735583,2021/06/09,tortor sollicitudin mi sit amet lobortis sapien sapien non mi integer ac neque duis bibendum morbi non
Glycopyrrolate,COK-971855328,2022/07/08,est risus auctor sed tristique in tempus sit amet sem
Clonazepam,BZS-237682086,2026/02/20,fusce consequat nulla nisl nunc nisl duis bibendum felis sed
Alpha-Caine,LMD-896437306,2025/09/17,vestibulum quam sapien varius ut blandit non interdum in ante vestibulum ante
CANARY GRASS POLLEN,BVQ-235440654,2024/09/16,sapien sapien non mi integer ac neque duis bibendum morbi non quam nec dui luctus rutrum nulla
SHISEIDO PERFECT REFINING FOUNDATION,VQO-554169523,2021/11/20,ultrices posuere cubilia curae nulla dapibus dolor vel est donec odio justo sollicitudin ut
Levothyroxine Sodium,CHJ-591010734,2025/04/02,in ante vestibulum ante ipsum primis in faucibus orci luctus et ultrices posuere cubilia curae
GENTAMICIN SULFATE,SFK-602273588,2024/10/25,semper interdum mauris ullamcorper purus sit amet nulla quisque arcu libero rutrum ac lobortis vel dapibus at diam
COVER FX BLEMISH TREATMENT PRIMER,URL-607501384,2023/05/13,tempor convallis nulla neque libero convallis eget eleifend luctus ultricies eu nibh quisque id justo sit amet
Doxycycline Hyclate,GHW-112218006,2024/12/30,donec posuere metus vitae ipsum aliquam non mauris morbi non
Navane,INJ-133718915,2023/04/30,ut massa volutpat convallis morbi odio odio elementum eu interdum eu tincidunt in leo maecenas pulvinar lobortis est phasellus sit
mupirocin,XUR-032561986,2021/05/04,non ligula pellentesque ultrices phasellus id sapien in sapien iaculis congue vivamus metus arcu adipiscing molestie hendrerit at vulputate
Cetirizine Hydrochloride,CDO-241022694,2025/09/21,urna pretium nisl ut volutpat sapien arcu sed augue aliquam erat volutpat in congue etiam justo etiam pretium iaculis
Zuplenz,EIQ-661126405,2021/08/05,integer ac leo pellentesque ultrices mattis odio donec vitae nisi
Trivora,TGY-972710291,2026/03/30,pede ullamcorper augue a suscipit nulla elit ac nulla sed vel enim sit
JANUMET,SGR-109399637,2026/03/31,rhoncus aliquam lacus morbi quis tortor id nulla ultrices aliquet maecenas leo odio condimentum
HEB,STJ-088146229,2022/04/25,ut odio cras mi pede malesuada in imperdiet et commodo vulputate justo in blandit ultrices
RISPERIDONE,HJF-390031290,2022/03/26,imperdiet sapien urna pretium nisl ut volutpat sapien arcu sed augue aliquam erat volutpat in
Bodycology,UNB-607505294,2024/01/23,sit amet justo morbi ut odio cras mi pede malesuada in imperdiet et commodo vulputate justo in
Phenytoin Sodium,YPV-257277806,2024/07/03,neque libero convallis eget eleifend luctus ultricies eu nibh quisque id justo sit amet sapien dignissim vestibulum vestibulum
Bethanechol Chloride,MOD-874217801,2025/08/02,lacus at turpis donec posuere metus vitae ipsum aliquam non mauris morbi non lectus aliquam
Levetiracetam,VSK-768817995,2024/02/09,potenti nullam porttitor lacus at turpis donec posuere metus vitae ipsum aliquam non mauris morbi non
Hy5,ZCB-913773386,2021/07/19,convallis eget eleifend luctus ultricies eu nibh quisque id justo sit amet sapien
Amoxicillin,IIQ-688613214,2023/12/09,sit amet consectetuer adipiscing elit proin interdum mauris non ligula pellentesque ultrices phasellus id sapien in sapien
Topiramate,WNA-428399654,2024/06/01,gravida sem praesent id massa id nisl venenatis lacinia aenean sit amet justo morbi ut odio cras
Amoxicillin,BER-337124300,2025/06/24,integer tincidunt ante vel ipsum praesent blandit lacinia erat vestibulum sed magna
Ibuprofen,OCN-219761176,2025/04/08,vel est donec odio justo sollicitudin ut suscipit a feugiat et eros vestibulum
HAWAIIAN Tropic,PLC-238356839,2022/11/05,nisi at nibh in hac habitasse platea dictumst aliquam augue quam sollicitudin vitae consectetuer eget rutrum
Felodipine,RNN-970675385,2022/06/14,tellus nulla ut erat id mauris vulputate elementum nullam varius nulla facilisi cras
Ignatia Bryophyllum,LZB-714534750,2026/02/12,maecenas ut massa quis augue luctus tincidunt nulla mollis molestie lorem quisque ut erat curabitur gravida
Cough - Asthma,HOG-607668658,2026/02/07,ac est lacinia nisi venenatis tristique fusce congue diam id
Protection,IOY-681472633,2025/09/06,lectus aliquam sit amet diam in magna bibendum imperdiet nullam orci pede venenatis non sodales sed tincidunt eu
BLACK BASS,CVJ-646224502,2024/10/09,nisi volutpat eleifend donec ut dolor morbi vel lectus in
Fentanyl Citrate,ZLK-398399561,2022/04/18,in purus eu magna vulputate luctus cum sociis natoque penatibus et magnis dis
CRH Medsense Simethicone 125mg Antigas,UMZ-183506564,2023/09/27,in tempus sit amet sem fusce consequat nulla nisl nunc nisl duis bibendum felis sed interdum venenatis turpis enim blandit
Select Brand Burn Relief,VKR-315229066,2021/09/16,a odio in hac habitasse platea dictumst maecenas ut massa quis augue luctus tincidunt nulla mollis molestie lorem
Diltiazem Hydrochloride Extended Release,ASD-679903648,2024/07/16,leo odio condimentum id luctus nec molestie sed justo pellentesque viverra pede ac
AVANDARYL,WWF-465577771,2026/01/13,amet nulla quisque arcu libero rutrum ac lobortis vel dapibus at diam
Bupropion Hydrochloride,OMP-763828333,2025/07/09,massa donec dapibus duis at velit eu est congue elementum in hac
Codeine Sulfate,MWU-719377214,2025/10/08,purus aliquet at feugiat non pretium quis lectus suspendisse potenti in eleifend quam a odio in hac habitasse platea dictumst
Aureobasidium pullulans,MUG-296239281,2023/01/23,enim lorem ipsum dolor sit amet consectetuer adipiscing elit proin interdum mauris non ligula pellentesque ultrices
Temozolomide,THF-678439764,2022/03/02,donec ut mauris eget massa tempor convallis nulla neque libero convallis eget eleifend luctus ultricies eu nibh
Triple Antibiotic,YZE-276976526,2021/08/16,suspendisse potenti cras in purus eu magna vulputate luctus cum sociis natoque penatibus et magnis dis
pain relief pm,FAX-131778532,2025/07/21,justo etiam pretium iaculis justo in hac habitasse platea dictumst etiam faucibus cursus urna ut tellus
Australian Gold,QZL-134607047,2025/03/19,sed lacus morbi sem mauris laoreet ut rhoncus aliquet pulvinar
Lisinopril with Hydrochlorothiazide,XJB-775275308,2022/08/10,leo odio condimentum id luctus nec molestie sed justo pellentesque viverra pede ac diam cras pellentesque volutpat
Quetiapine Fumarate,GKH-510133670,2023/10/25,ridiculus mus etiam vel augue vestibulum rutrum rutrum neque aenean auctor
Alcohol swab,QVH-935329948,2022/05/01,purus phasellus in felis donec semper sapien a libero nam dui proin leo odio porttitor id
AMARANTHUS SPINOSUS POLLEN,KEN-406925741,2023/03/09,tincidunt in leo maecenas pulvinar lobortis est phasellus sit amet erat nulla
germstar Original unscented,FZI-666276470,2024/09/07,nascetur ridiculus mus vivamus vestibulum sagittis sapien cum sociis natoque penatibus et
Medline Peroxi Fresh,KFY-776659025,2025/11/13,accumsan tellus nisi eu orci mauris lacinia sapien quis libero nullam sit amet turpis elementum ligula
LEVOTHYROXINE SODIUM,LNQ-239030907,2021/07/20,vestibulum ante ipsum primis in faucibus orci luctus et ultrices posuere cubilia
Gold Bond Extra Strength,DSH-045227048,2024/04/08,quam fringilla rhoncus mauris enim leo rhoncus sed vestibulum sit amet cursus id turpis integer aliquet massa
Oxygen,GWL-691434642,2021/04/04,amet eros suspendisse accumsan tortor quis turpis sed ante vivamus tortor duis mattis egestas metus aenean
Hi and Dri Antiperspirant,ICJ-701601897,2024/05/23,blandit lacinia erat vestibulum sed magna at nunc commodo placerat praesent
Invisible Splash Hair Minimizing Roll-On Antiperspirant,KYF-845443504,2025/11/26,leo maecenas pulvinar lobortis est phasellus sit amet erat nulla tempus vivamus in felis eu sapien cursus
Millet,DNR-031348385,2026/01/22,rutrum nulla nunc purus phasellus in felis donec semper sapien a libero nam dui proin leo odio
Irbesartan and Hydrochlorothiazide,HWB-190422573,2023/02/06,eros elementum pellentesque quisque porta volutpat erat quisque erat eros viverra
CARBIDOPA AND LEVODOPA,SZP-099507058,2022/05/22,eleifend pede libero quis orci nullam molestie nibh in lectus
Glyburide (micronized) and Metformin Hydrochloride,UMY-751411564,2021/10/04,congue elementum in hac habitasse platea dictumst morbi vestibulum velit id pretium iaculis diam erat fermentum justo nec condimentum
Theophylline,OMS-423276800,2025/02/14,egestas metus aenean fermentum donec ut mauris eget massa tempor convallis nulla neque libero convallis
Zafirlukast,NAN-160196202,2022/05/22,phasellus in felis donec semper sapien a libero nam dui proin leo odio porttitor id consequat in consequat
Lovastatin,AXT-444485936,2022/10/21,justo sollicitudin ut suscipit a feugiat et eros vestibulum ac est lacinia nisi venenatis
Diphenhydramine Hydrochloride,POZ-191150424,2023/05/19,vestibulum velit id pretium iaculis diam erat fermentum justo nec condimentum neque sapien placerat ante nulla justo aliquam quis turpis
Mulberry,KYL-112098540,2024/09/13,viverra dapibus nulla suscipit ligula in lacus curabitur at ipsum ac tellus semper interdum mauris
Claritin,VLK-899040353,2023/04/27,ultricies eu nibh quisque id justo sit amet sapien dignissim vestibulum vestibulum ante ipsum primis in faucibus orci
Roota Re V Tonic,FQI-799614968,2025/01/13,ut at dolor quis odio consequat varius integer ac leo pellentesque
NORTH Antiseptic First Aid,BNX-213905987,2025/01/05,sapien quis libero nullam sit amet turpis elementum ligula vehicula consequat morbi a ipsum integer a nibh
CARBIDOPA AND LEVODOPA,EAP-953843516,2021/12/09,nec condimentum neque sapien placerat ante nulla justo aliquam quis turpis eget elit sodales scelerisque
Naproxen Sodium,NWU-241867238,2022/09/08,morbi a ipsum integer a nibh in quis justo maecenas rhoncus aliquam lacus morbi
Carvedilol,IRY-806163648,2023/07/20,curae nulla dapibus dolor vel est donec odio justo sollicitudin ut suscipit a feugiat et eros vestibulum
Releev Cold Sore Treatment,OZT-887853554,2025/04/15,pede morbi porttitor lorem id ligula suspendisse ornare consequat lectus in est risus auctor sed tristique in
Isosorbide Dinitrate,OTV-641049977,2023/09/25,viverra eget congue eget semper rutrum nulla nunc purus phasellus in felis donec
Bupropion Hydrochloride,LRM-266593379,2026/03/17,vel nisl duis ac nibh fusce lacus purus aliquet at feugiat non pretium
Hydroxyzine HCl,QCK-214128445,2025/11/10,posuere nonummy integer non velit donec diam neque vestibulum eget vulputate ut
Heparin Lock Flush,CZB-219269674,2024/05/08,at turpis a pede posuere nonummy integer non velit donec diam neque vestibulum eget vulputate ut ultrices vel
Fungicure,SSB-977752592,2022/02/26,platea dictumst maecenas ut massa quis augue luctus tincidunt nulla mollis molestie lorem quisque ut erat curabitur gravida nisi at
Isomers Clear Skin Acne Treatment Gel,CBZ-261283910,2023/01/23,massa volutpat convallis morbi odio odio elementum eu interdum eu tincidunt
Ropinirole Hydrochloride,ERL-554242368,2024/08/26,adipiscing lorem vitae mattis nibh ligula nec sem duis aliquam convallis nunc proin
Dendracin Neurodendraxcin,EIZ-351339104,2025/09/26,nulla tellus in sagittis dui vel nisl duis ac nibh fusce lacus purus aliquet at feugiat non
ATOPALM CLOTRIMAZOLE ANTIFUNGAL,UFC-601674227,2024/10/01,diam neque vestibulum eget vulputate ut ultrices vel augue vestibulum ante ipsum primis in faucibus orci luctus et ultrices
Enoxaparin sodium,RBG-424890075,2022/05/18,est donec odio justo sollicitudin ut suscipit a feugiat et eros
Moxifloxacin Hydrochloride,KRD-918448981,2022/09/29,penatibus et magnis dis parturient montes nascetur ridiculus mus vivamus vestibulum
Alba Kids Mineral Sunblock SPF 30,ILI-456336834,2025/04/17,interdum venenatis turpis enim blandit mi in porttitor pede justo eu massa donec dapibus duis at velit eu
Phenazopyridine Hydrochloride,AAE-544057022,2021/12/11,pellentesque viverra pede ac diam cras pellentesque volutpat dui maecenas tristique est et tempus semper est quam pharetra magna ac
Childrens Allergy Relief,TRT-660050760,2023/01/30,aliquam erat volutpat in congue etiam justo etiam pretium iaculis justo
Ifosfamide,PGS-622879530,2023/06/13,ut massa volutpat convallis morbi odio odio elementum eu interdum eu tincidunt in leo maecenas pulvinar lobortis est phasellus sit
American Infection Control Antiseptic Hand Wipes,WTH-230809206,2021/07/23,pharetra magna vestibulum aliquet ultrices erat tortor sollicitudin mi sit amet lobortis sapien sapien non mi integer ac neque
GFA 42 Essential First Aid Items,BBC-205007691,2023/06/07,rhoncus mauris enim leo rhoncus sed vestibulum sit amet cursus id turpis
Lotensin HCT,HJL-737315766,2023/09/24,orci eget orci vehicula condimentum curabitur in libero ut massa
Garnier,CKZ-953721600,2022/11/12,quis lectus suspendisse potenti in eleifend quam a odio in hac habitasse platea dictumst maecenas
Terconazole,FIQ-751103742,2025/12/01,blandit non interdum in ante vestibulum ante ipsum primis in
Cymbalta,IMS-116605108,2025/10/04,ultrices posuere cubilia curae donec pharetra magna vestibulum aliquet ultrices erat tortor sollicitudin mi sit amet lobortis sapien
oxycodone hydrochloride,ECU-885289285,2022/09/23,at dolor quis odio consequat varius integer ac leo pellentesque ultrices mattis odio donec vitae nisi
Good Sense Nighttime Cough,PLP-774980609,2022/08/04,vel nulla eget eros elementum pellentesque quisque porta volutpat erat quisque erat eros
HYDROCODONE BITARTRATE AND ACETAMINOPHEN,HQH-206659197,2024/08/13,adipiscing lorem vitae mattis nibh ligula nec sem duis aliquam convallis nunc proin at turpis a pede posuere nonummy
Childrens Colic RELIEF,MSN-028038677,2024/09/15,ultrices vel augue vestibulum ante ipsum primis in faucibus orci luctus et ultrices posuere cubilia curae
UV Capture Water Zero Sunspray,UCM-223110086,2021/08/26,non velit donec diam neque vestibulum eget vulputate ut ultrices vel augue vestibulum ante
healthy accents ibuprofen,KJH-222223821,2025/09/08,consequat varius integer ac leo pellentesque ultrices mattis odio donec vitae nisi
PrismaSol,JVR-000071562,2022/04/27,quis tortor id nulla ultrices aliquet maecenas leo odio condimentum id luctus nec molestie
good sense allergy relief,ZZV-775849815,2023/12/12,pharetra magna vestibulum aliquet ultrices erat tortor sollicitudin mi sit amet lobortis sapien sapien non mi integer ac neque duis
Zep Acclaim,RQG-915011545,2024/07/31,pede ullamcorper augue a suscipit nulla elit ac nulla sed vel
Antiperspirant,VTZ-062650413,2021/11/26,elementum ligula vehicula consequat morbi a ipsum integer a nibh in quis justo
Phenazopyridine HCl,VBM-277856493,2022/03/15,consequat ut nulla sed accumsan felis ut at dolor quis odio consequat varius integer ac leo pellentesque ultrices mattis
Eve Lom Brilliant Cover Concealer Broad Spectrum SPF 15 Sunscreen,BUR-236578624,2023/03/25,sapien quis libero nullam sit amet turpis elementum ligula vehicula consequat
Treatment Set TS344801,DVO-727230514,2023/06/22,at nulla suspendisse potenti cras in purus eu magna vulputate luctus cum sociis natoque
Zonegran,KVP-065309870,2021/04/19,facilisi cras non velit nec nisi vulputate nonummy maecenas tincidunt lacus at velit vivamus vel nulla eget eros elementum pellentesque
Robinia Nicotiana,YAZ-514268408,2025/01/18,posuere cubilia curae nulla dapibus dolor vel est donec odio justo sollicitudin ut suscipit a
Sterile Diluent for Allergenic Extract,GBU-258896028,2022/04/26,lectus pellentesque eget nunc donec quis orci eget orci vehicula condimentum curabitur in libero ut massa volutpat
